Symbol,Name,Country,IPO,Sector,Industry
QUMU,Qumu Corporation Common Stock,United States,,Technology,Retail: Computer Software & Peripheral Equipment
QURE,uniQure N.V. Ordinary Shares,Netherlands,2014.0,Health Care,Biotechnology: Pharmaceutical Preparations
RACB,Research Alliance Corp. II Class A Common Stock,United States,2021.0,,
RADA,RADA Electronic Industries Ltd. Ordinary Shares,Israel,,,
RADI,Radius Global Infrastructure Inc. Class A Common Stock,United States,,Consumer Services,Telecommunications Equipment
RAIL,FreightCar America Inc. Common Stock,United States,2005.0,Capital Goods,Railroads
RAIN,Rain Therapeutics Inc. Common Stock,United States,2021.0,Health Care,Biotechnology: Pharmaceutical Preparations
RAM,Aries I Acquisition Corporation Class A Ordinary Share,Cayman Islands,2021.0,Finance,Business Services
RAMMU,Aries I Acquisition Corporation Unit,Cayman Islands,2021.0,Finance,Business Services
RAMMW,Aries I Acquisition Corporation Warrant,Cayman Islands,2021.0,Finance,Business Services
RAND,Rand Capital Corporation Common Stock,United States,,Finance,Finance/Investors Services
RANI,Rani Therapeutics Holdings Inc. Class A Common Stock,United States,2021.0,Consumer Durables,Specialty Chemicals
RAPT,RAPT Therapeutics Inc. Common Stock,United States,2019.0,Health Care,Biotechnology: Pharmaceutical Preparations
RARE,Ultragenyx Pharmaceutical Inc. Common Stock,United States,2014.0,Health Care,Biotechnology: Pharmaceutical Preparations
RAVE,Rave Restaurant Group Inc. Common Stock,United States,,Consumer Services,Restaurants
RAVN,Raven Industries Inc. Common Stock,United States,,Capital Goods,Office Equipment/Supplies/Services
RBB,RBB Bancorp Common Stock,United States,2017.0,Finance,Commercial Banks
RBBN,Ribbon Communications Inc. Common Stock,United States,,Technology,EDP Services
RBCAA,Republic Bancorp Inc. Class A Common Stock,United States,1998.0,Finance,Major Banks
RBCN,Rubicon Technology Inc. Common Stock,United States,2007.0,Technology,Semiconductors
RBKB,Rhinebeck Bancorp Inc. Common Stock,United States,2019.0,Finance,Major Banks
RBNC,Reliant Bancorp Inc. Common Stock,United States,,Finance,Major Banks
RCAT,Red Cat Holdings Inc. Common Stock,United States,,Technology,Retail: Computer Software & Peripheral Equipment
RCEL,Avita Therapeutics Inc. Common Stock,United States,,Health Care,Medical Specialities
RCHG,Recharge Acquisition Corp. Class A Common Stock,United States,2020.0,,
RCHGU,Recharge Acquisition Corp. Unit,United States,2020.0,,
RCHGW,Recharge Acquisition Corp. Warrant,United States,2020.0,,
RCII,Rent-A-Center Inc. Common Stock,United States,1995.0,Technology,Diversified Commercial Services
RCKT,Rocket Pharmaceuticals Inc. Common Stock,United States,2015.0,Health Care,Biotechnology: Pharmaceutical Preparations
RCKY,Rocky Brands Inc. Common Stock,United States,1993.0,Consumer Non-Durables,Shoe Manufacturing
RCLF,Rosecliff Acquisition Corp I Class A Common Stock,United States,2021.0,,
RCLFU,Rosecliff Acquisition Corp I Unit,United States,2021.0,,
RCLFW,Rosecliff Acquisition Corp I Warrants,United States,2021.0,,
RCM,R1 RCM Inc. Common Stock,United States,,Consumer Services,Other Consumer Services
RCMT,RCM Technologies Inc. Common Stock,United States,,Consumer Services,Military/Government/Technical
RCON,Recon Technology Ltd. Class A Ordinary Shares,China,2009.0,Energy,Oilfield Services/Equipment
RCRT,Recruiter.com Group Inc. Common Stock,United States,,,
RCRTW,Recruiter.com Group Inc. Warrant,United States,,,
RDBX,Redbox Entertainment Inc. Class A Common Stock,United States,2020.0,,
RDBXW,Redbox Entertainment Inc. Warrant,United States,2020.0,,
RDCM,Radcom Ltd. Ordinary Shares,Israel,1997.0,Technology,Computer peripheral equipment
RDFN,Redfin Corporation Common Stock,United States,2017.0,Finance,Real Estate
RDHL,Redhill Biopharma Ltd. American Depositary Shares,Israel,,Health Care,Biotechnology: Pharmaceutical Preparations
RDI,Reading International Inc Class A Common Stock,United States,,Consumer Services,Movies/Entertainment
RDIB,Reading International Inc Class B Common Stock,United States,,Consumer Services,Movies/Entertainment
RDNT,RadNet Inc. Common Stock,United States,,Health Care,Medical Specialities
RDUS,Radius Health Inc. Common Stock,United States,2014.0,Health Care,Biotechnology: Pharmaceutical Preparations
RDVT,Red Violet Inc. Common Stock ,United States,,Technology,Computer Software: Prepackaged Software
RDWR,Radware Ltd. Ordinary Shares,Israel,1999.0,Technology,EDP Services
REAL,The RealReal Inc. Common Stock,United States,2019.0,Consumer Non-Durables,Consumer Specialties
REAX,The Real Brokerage Inc. Common Shares,Canada,,,
REDU,RISE Education Cayman Ltd American Depositary Shares,China,2017.0,Miscellaneous,Service to the Health Industry
REE,REE Automotive Ltd. Class A Ordinary Shares,Israel,,,
REEAW,REE Automotive Ltd. Warrant,Israel,,,
REED,Reeds Inc. Common Stock,United States,,Consumer Non-Durables,Beverages (Production/Distribution)
REFR,Research Frontiers Incorporated Common Stock,United States,,Capital Goods,Industrial Machinery/Components
REG,Regency Centers Corporation Common Stock,United States,1993.0,Consumer Services,Real Estate Investment Trusts
REGI,Renewable Energy Group Inc. Common Stock,United States,2012.0,Basic Industries,Major Chemicals
REGN,Regeneron Pharmaceuticals Inc. Common Stock,United States,1991.0,Health Care,Biotechnology: Pharmaceutical Preparations
REKR,Rekor Systems Inc. Common Stock,United States,,Technology,EDP Services
RELI,Reliance Global Group Inc. Common Stock,United States,,Finance,Specialty Insurers
RELIW,Reliance Global Group Inc. Series A Warrants,United States,,Finance,Specialty Insurers
RELL,Richardson Electronics Ltd. Common Stock,United States,1983.0,Technology,Electronic Components
RELY,Remitly Global Inc. Common Stock,United States,2021.0,Technology,Computer Software: Prepackaged Software
RENT,Rent the Runway Inc. Class A Common Stock,United States,2021.0,Consumer Non-Durables,Department/Specialty Retail Stores
REPH,Recro Pharma Inc. Common Stock,United States,2014.0,Health Care,Biotechnology: Pharmaceutical Preparations
REPL,Replimune Group Inc. Common Stock,United States,2018.0,Health Care,Biotechnology: Pharmaceutical Preparations
RESN,Resonant Inc. Common Stock,United States,2014.0,Technology,Semiconductors
RETA,Reata Pharmaceuticals Inc. Class A Common Stock,United States,2016.0,Health Care,Biotechnology: Pharmaceutical Preparations
RETO,ReTo Eco-Solutions Inc. Common Shares,China,2017.0,Capital Goods,Multi-Sector Companies
REVE,Alpine Acquisition Corporation Common Stock,United States,2021.0,,
REVEU,Alpine Acquisition Corporation Unit,United States,2021.0,,
REVEW,Alpine Acquisition Corporation Warrant,United States,2021.0,,
REVH,Revolution Healthcare Acquisition Corp. SAIL Class A Common Stock,United States,2021.0,,
REVHU,Revolution Healthcare Acquisition Corp. SAIL Units,United States,2021.0,,
REVHW,Revolution Healthcare Acquisition Corp. SAIL Warrant.,United States,2021.0,,
REYN,Reynolds Consumer Products Inc. Common Stock,United States,2020.0,Capital Goods,Office Equipment/Supplies/Services
RFIL,RF Industries Ltd. Common Stock,United States,,Capital Goods,Electrical Products
RGC,Regencell Bioscience Holdings Limited Ordinary Shares,Hong Kong,2021.0,,
RGCO,RGC Resources Inc. Common Stock,United States,,Public Utilities,Oil & Gas Production
RGEN,Repligen Corporation Common Stock,United States,1986.0,Health Care,Medical/Dental Instruments
RGF,The Real Good Food Company Inc. Class A Common Stock,United States,2021.0,Consumer Non-Durables,Food Distributors
RGLD,Royal Gold Inc. Common Stock,United States,,,
RGLS,Regulus Therapeutics Inc. Common Stock,United States,2012.0,Health Care,Biotechnology: Pharmaceutical Preparations
RGNX,REGENXBIO Inc. Common Stock,United States,2015.0,Health Care,Biotechnology: Biological Products (No Diagnostic Substances)
RGP,Resources Connection Inc. Common Stock,United States,,Miscellaneous,Business Services
RIBT,RiceBran Technologies Common Stock,United States,,Consumer Non-Durables,Specialty Foods
RICK,RCI Hospitality Holdings Inc. Common Stock,United States,1995.0,Consumer Services,Restaurants
RICO,Agrico Acquisition Corp. Class A Ordinary Shares,Cayman Islands,2021.0,,
RICOU,Agrico Acquisition Corp. Unit,Cayman Islands,2021.0,,
RICOW,Agrico Acquisition Corp. Warrant,Cayman Islands,2021.0,,
RIDE,Lordstown Motors Corp. Class A Common Stock,United States,2019.0,Capital Goods,Construction/Ag Equipment/Trucks
RIGL,Rigel Pharmaceuticals Inc. Common Stock,United States,2000.0,Health Care,Biotechnology: Pharmaceutical Preparations
RILY,B. Riley Financial Inc. Common Stock,United States,,Finance,Investment Managers
RILYK,B. Riley Financial Inc. 5.50% Senior Notes Due 2026,United States,,Miscellaneous,Business Services
RILYL,B. Riley Financial Inc. Depositary Shares each representing 1/1000th in a share of 7.375% Series B Cumulative Perpetual Preferred Stock par value $0.0001,United States,,Finance,Investment Managers
RILYM,B. Riley Financial Inc. 6.375% Senior Notes due 2025,United States,,Miscellaneous,Business Services
RILYN,B. Riley Financial Inc. 6.50% Senior Notes Due 2026,United States,,Miscellaneous,Business Services
RILYO,B. Riley Financial Inc. 6.75% Senior Notes due 2024,United States,,Miscellaneous,Business Services
RILYP,B. Riley Financial Inc. Depositary Shares each representing a 1/1000th fractional interest in a share of Series A Cumulative Perpetual Preferred Stock,United States,,Finance,Investment Managers
RILYT,B. Riley Financial Inc. 6.00% Senior Notes Due 2028,United States,,Miscellaneous,Business Services
RILYZ,B. Riley Financial Inc. 5.25% Senior Notes due 2028,United States,,Miscellaneous,Business Services
RIOT,Riot Blockchain Inc.  Common Stock ,United States,,Technology,Retail: Computer Software & Peripheral Equipment
RIVE,Riverview Financial Corporation Common Stock,United States,,Finance,Major Banks
RIVN,Rivian Automotive Inc. Class A Common Stock,United States,2021.0,Capital Goods,Auto Manufacturing
RKDA,Arcadia Biosciences Inc. Common Stock,United States,2015.0,Basic Industries,Agricultural Chemicals
RKLB,Rocket Lab USA Inc. Common Stock,United States,2020.0,Capital Goods,Aerospace
RKLBW,Rocket Lab USA Inc. Warrant,United States,2020.0,Capital Goods,Aerospace
RLAY,Relay Therapeutics Inc. Common Stock,United States,2020.0,Health Care,Biotechnology: Pharmaceutical Preparations
RLMD,Relmada Therapeutics Inc. Common Stock,United States,,Health Care,Biotechnology: Pharmaceutical Preparations
RLYB,Rallybio Corporation Common Stock,United States,2021.0,Health Care,Biotechnology: Pharmaceutical Preparations
RMBI,Richmond Mutual Bancorporation Inc. Common Stock,United States,2019.0,,
RMBL,RumbleOn Inc. Class B Common Stock,United States,,Capital Goods,Automotive Aftermarket
RMBS,Rambus Inc. Common Stock,United States,1997.0,Technology,Semiconductors
RMCF,Rocky Mountain Chocolate Factory Inc. Common Stock,United States,,Consumer Non-Durables,Specialty Foods
RMGC,RMG Acquisition Corp. III Class A Ordinary Shares,United States,2021.0,Finance,Business Services
RMGCU,RMG Acquisition Corp. III Unit,United States,2021.0,Finance,Business Services
RMGCW,RMG Acquisition Corp. III Warrant,United States,2021.0,Finance,Business Services
RMNI,Rimini Street Inc. (DE) Common Stock,United States,2015.0,Technology,EDP Services
RMR,The RMR Group Inc. Class A Common Stock,United States,,Finance,Real Estate
RMTI,Rockwell Medical Inc. (DE) Common Stock,United States,1998.0,Health Care,Biotechnology: Pharmaceutical Preparations
RNA,Avidity Biosciences Inc. Common Stock,United States,2020.0,Health Care,Biotechnology: Pharmaceutical Preparations
RNAZ,TransCode Therapeutics Inc. Common Stock,United States,2021.0,Health Care,Biotechnology: Pharmaceutical Preparations
RNDB,Randolph Bancorp Inc. Common Stock,United States,2016.0,Finance,Major Banks
RNERU,Mount Rainier Acquisition Corp. Unit,United States,2021.0,,
RNLX,Renalytix plc American Depositary Shares,United Kingdom,2020.0,Health Care,Medical Specialities
RNST,Renasant Corporation Common Stock,United States,,Finance,Major Banks
RNW,ReNew Energy Global plc Class A Ordinary Shares,United Kingdom,,,
RNWK,RealNetworks Inc. Common Stock,United States,1997.0,Technology,EDP Services
RNWWW,ReNew Energy Global plc Warrant,United Kingdom,,,
RNXT,RenovoRx Inc. Common Stock,United States,2021.0,Health Care,Biotechnology: Pharmaceutical Preparations
ROAD,Construction Partners Inc. Class A Common Stock,United States,2018.0,Capital Goods,Engineering & Construction
ROCC,Ranger Oil Corporation Class A Common Stock,United States,,Energy,Oil & Gas Production
ROCG,Roth CH Acquisition IV Co. Common Stock,United States,2021.0,,
ROCGU,Roth CH Acquisition IV Co. Unit,United States,2021.0,,
ROCGW,Roth CH Acquisition IV Co. Warrant,United States,2021.0,,
ROCK,Gibraltar Industries Inc. Common Stock,United States,1993.0,,
ROCR,Roth CH Acquisition III Co. Common stock,United States,2021.0,,
ROCRU,Roth CH Acquisition III Co. Unit,United States,2021.0,,
ROCRW,Roth CH Acquisition III Co. Warrant,United States,2021.0,,
ROIC,Retail Opportunity Investments Corp. Common Stock (MD),United States,,Consumer Services,Real Estate Investment Trusts
ROIV,Roivant Sciences Ltd. Common Shares,United Kingdom,,,
ROIVW,Roivant Sciences Ltd. Warrant,United Kingdom,,,
ROKU,Roku Inc. Class A Common Stock,United States,2017.0,Consumer Services,Television Services
ROLL,RBC Bearings Incorporated Common Stock,United States,2005.0,Capital Goods,Metal Fabrications
ROLLP,RBC Bearings Incorporated 5.00% Series A Mandatory Convertible Preferred Stock,United States,,Capital Goods,Metal Fabrications
ROOT,Root Inc. Class A Common Stock,United States,2020.0,Finance,Property-Casualty Insurers
ROSEU,Rose Hill Acquisition Corporation Unit,United States,2021.0,,
ROST,Ross Stores Inc. Common Stock,United States,1985.0,Consumer Services,Clothing/Shoe/Accessory Stores
ROVR,Rover Group Inc. Class A Common Stock,United States,2021.0,Miscellaneous,Other Consumer Services
ROVRW,Rover Group Inc. Warrant,United States,2021.0,Miscellaneous,Other Consumer Services
RPAY,Repay Holdings Corporation Class A Common Stock,United States,2018.0,Technology,EDP Services
RPD,Rapid7 Inc. Common Stock,United States,2015.0,Technology,Computer Software: Prepackaged Software
RPHM,Reneo Pharmaceuticals Inc. Common Stock,United States,2021.0,Health Care,Biotechnology: Pharmaceutical Preparations
RPID,Rapid Micro Biosystems Inc. Class A Common Stock,United States,2021.0,Health Care,Medical Specialities
RPRX,Royalty Pharma plc Class A Ordinary Shares ,United States,2020.0,Health Care,Biotechnology: Pharmaceutical Preparations
RPTX,Repare Therapeutics Inc. Common Shares,Canada,2020.0,,
RRBI,Red River Bancshares Inc. Common Stock,United States,2019.0,Finance,Commercial Banks
RRGB,Red Robin Gourmet Burgers Inc. Common Stock,United States,2002.0,Consumer Services,Restaurants
RRR,Red Rock Resorts Inc. Class A Common Stock,United States,2016.0,Consumer Services,Recreational Products/Toys
RSLS,ReShape Lifesciences Inc. Common Stock,United States,2016.0,Health Care,Biotechnology: Electromedical & Electrotherapeutic Apparatus
RSSS,Research Solutions Inc Common Stock,United States,,Technology,Retail: Computer Software & Peripheral Equipment
RSVR,Reservoir Media Inc. Common Stock,United States,2021.0,Consumer Services,Movies/Entertainment
RSVRW,Reservoir Media Inc. Warrant,United States,2021.0,Consumer Services,Movies/Entertainment
RTLR,Rattler Midstream LP Common Units,United States,2019.0,Energy,Oilfield Services/Equipment
RUBY,Rubius Therapeutics Inc. Common Stock,United States,2018.0,Health Care,Biotechnology: Biological Products (No Diagnostic Substances)
RUN,Sunrun Inc. Common Stock,United States,2015.0,Capital Goods,Building Products
RUSHA,Rush Enterprises Inc. Common Stock Cl A,United States,,Consumer Services,Other Specialty Stores
RUSHB,Rush Enterprises Inc. Class B,United States,,Consumer Services,Other Specialty Stores
RUTH,Ruth's Hospitality Group Inc. Common Stock,United States,2005.0,Consumer Services,Restaurants
RVAC,Riverview Acquisition Corp. Class A Common Stock,United States,2021.0,,
RVACU,Riverview Acquisition Corp. Unit,United States,2021.0,,
RVACW,Riverview Acquisition Corp. Warrant,United States,2021.0,,
RVMD,Revolution Medicines Inc. Common Stock,United States,2020.0,Consumer Durables,Specialty Chemicals
RVNC,Revance Therapeutics Inc. Common Stock,United States,2014.0,Health Care,Biotechnology: Pharmaceutical Preparations
RVPH,Reviva Pharmaceuticals Holdings Inc. Common Stock ,United States,2020.0,Health Care,Biotechnology: Pharmaceutical Preparations
RVPHW,Reviva Pharmaceuticals Holdings Inc. Warrants,United States,2018.0,Health Care,Biotechnology: Pharmaceutical Preparations
RVSB,Riverview Bancorp Inc Common Stock,United States,,Finance,Major Banks
RWAY,Runway Growth Finance Corp. Common Stock,United States,2021.0,,
RWLK,ReWalk Robotics Ltd. Ordinary Shares,Israel,2014.0,Health Care,Industrial Specialties
RXDX,Prometheus Biosciences Inc. Common Stock,United States,2021.0,Health Care,Biotechnology: Pharmaceutical Preparations
RXRA,RXR Acquisition Corp. Class A Common Stock,United States,2021.0,,
RXRAW,RXR Acquisition Corp. Warrants to purchase Class A common stock,United States,2021.0,,
RXRX,Recursion Pharmaceuticals Inc. Class A Common Stock,United States,2021.0,Health Care,Biotechnology: Pharmaceutical Preparations
RXST,RxSight Inc. Common Stock,United States,2021.0,Health Care,Biotechnology: Electromedical & Electrotherapeutic Apparatus
RXT,Rackspace Technology Inc. Common Stock,United States,2020.0,Technology,EDP Services
RYAAY,Ryanair Holdings plc American Depositary Shares,Ireland,1997.0,Transportation,Air Freight/Delivery Services
RYTM,Rhythm Pharmaceuticals Inc. Common Stock,United States,2017.0,Health Care,Biotechnology: Pharmaceutical Preparations
RZLT,Rezolute Inc. Common Stock (NV),United States,,Health Care,Biotechnology: Pharmaceutical Preparations
SABR,Sabre Corporation Common Stock,United States,2014.0,Technology,EDP Services
SABRP,Sabre Corporation 6.50% Series A Mandatory Convertible Preferred Stock,United States,,Technology,EDP Services
SABS,SAB Biotherapeutics Inc. Common Stock,United States,2021.0,Health Care,Biotechnology: Pharmaceutical Preparations
SABSW,SAB Biotherapeutics Inc. Warrant,United States,2021.0,Health Care,Biotechnology: Pharmaceutical Preparations
SAFM,Sanderson Farms Inc. Common Stock,United States,1987.0,,
SAFT,Safety Insurance Group Inc. Common Stock,United States,2002.0,Finance,Property-Casualty Insurers
SAGE,Sage Therapeutics Inc. Common Stock,United States,2014.0,Health Care,Biotechnology: Pharmaceutical Preparations
SAIA,Saia Inc. Common Stock,United States,,Transportation,Trucking Freight/Courier Services
SAL,Salisbury Bancorp Inc. Common Stock,United States,,Finance,Savings Institutions
SALM,Salem Media Group Inc. Class A Common Stock,United States,1999.0,Consumer Services,Broadcasting
SAMAU,Schultze Special Purpose Acquisition Corp. II Units,United States,2021.0,,
SAMG,Silvercrest Asset Management Group Inc. Class A Common Stock,United States,2013.0,Finance,Investment Managers
SANA,Sana Biotechnology Inc. Common Stock,United States,2021.0,Consumer Durables,Specialty Chemicals
SANB,Sanaby Health Acquisition Corp. I Class A Common Stock,United States,2021.0,,
SANBU,Sanaby Health Acquisition Corp. I Unit,United States,2021.0,,
SANBW,Sanaby Health Acquisition Corp. I Warrant,United States,2021.0,,
SANM,Sanmina Corporation Common Stock,United States,1993.0,Technology,Electrical Products
SANW,S&W Seed Company Common Stock (NV),United States,,,Farming/Seeds/Milling
SASR,Sandy Spring Bancorp Inc. Common Stock,United States,,Finance,Major Banks
SATS,EchoStar  Corporation Common Stock,United States,,Technology,Radio And Television Broadcasting And Communications Equipment
SAVA,Cassava Sciences Inc. Common Stock,United States,,Health Care,Biotechnology: Pharmaceutical Preparations
SBAC,SBA Communications Corporation Class A Common Stock,United States,1999.0,Consumer Services,Real Estate Investment Trusts
SBCF,Seacoast Banking Corporation of Florida Common Stock,United States,,Finance,Major Banks
SBEA,SilverBox Engaged Merger Corp I Class A Common Stock,United States,2021.0,,
SBEAU,SilverBox Engaged Merger Corp I Units,United States,2021.0,,
SBEAW,SilverBox Engaged Merger Corp I Warrant,United States,2021.0,,
SBET,SharpLink Gaming Ltd. Ordinary Shares,Israel,,Public Utilities,Telecommunications Equipment
SBFG,SB Financial Group Inc. Common Stock,United States,,Finance,Major Banks
SBGI,Sinclair Broadcast Group Inc. Class A Common Stock,United States,1995.0,Consumer Services,Broadcasting
SBLK,Star Bulk Carriers Corp. Common Shares,Greece,,Transportation,Marine Transportation
SBNY,Signature Bank Common Stock,United States,2004.0,Finance,Major Banks
SBNYP,Signature Bank Depositary shares each representing a 1/40th ownership interest in a share of 5.000% Noncumulative Perpetual Series A Preferred Stock,United States,,Finance,Major Banks
SBRA,Sabra Health Care REIT Inc. Common Stock,United States,,Consumer Services,Real Estate Investment Trusts
SBSI,Southside Bancshares Inc. Common Stock,United States,,Finance,Major Banks
SBT,Sterling Bancorp Inc. Common Stock,United States,2017.0,Finance,Savings Institutions
SBTX,Silverback Therapeutics Inc. Common Stock,United States,2020.0,Consumer Durables,Specialty Chemicals
SBUX,Starbucks Corporation Common Stock,United States,1992.0,,
SCAQ,Stratim Cloud Acquisition Corp. Class A Common Stock,United States,2021.0,,
SCAQW,Stratim Cloud Acquisition Corp. Warrant,United States,2021.0,,
SCHL,Scholastic Corporation Common Stock,United States,1992.0,Consumer Services,Books
SCHN,Schnitzer Steel Industries Inc. Class A Common Stock,United States,1993.0,Basic Industries,Steel/Iron Ore
SCKT,Socket Mobile Inc. Common Stock,United States,,Technology,Computer Manufacturing
SCLE,Broadscale Acquisition Corp. Class A common stock,United States,2021.0,,
SCLEU,Broadscale Acquisition Corp. Units,United States,2021.0,,
SCLEW,Broadscale Acquisition Corp. Warrant,United States,2021.0,,
SCMAU,Seaport Calibre Materials Acquisition Corp. Unit,United States,2021.0,Consumer Services,Other Pharmaceuticals
SCOA,ScION Tech Growth I Class A Ordinary Shares,United Kingdom,2021.0,Finance,Business Services
SCOAU,ScION Tech Growth I Unit,United Kingdom,2020.0,Finance,Business Services
SCOAW,ScION Tech Growth I Warrant,United Kingdom,2021.0,Finance,Business Services
SCOB,ScION Tech Growth II Class A Ordinary Shares,United Kingdom,2021.0,Finance,Business Services
SCOBU,ScION Tech Growth II Units,United Kingdom,2021.0,Finance,Business Services
SCOBW,ScION Tech Growth II Warrants,United Kingdom,2021.0,Finance,Business Services
SCOR,comScore Inc. Common Stock,United States,2018.0,Miscellaneous,Business Services
SCPH,scPharmaceuticals Inc. Common Stock,United States,2017.0,Health Care,Biotechnology: Pharmaceutical Preparations
SCPL,SciPlay Corporation Class A Common Stock,United States,2019.0,Technology,Computer Software: Prepackaged Software
SCPS,Scopus BioPharma Inc. Common Stock,United States,2020.0,Health Care,Biotechnology: Pharmaceutical Preparations
SCSC,ScanSource Inc. Common Stock,United States,,Technology,Retail: Computer Software & Peripheral Equipment
SCVL,Shoe Carnival Inc. Common Stock,United States,1993.0,Consumer Services,Clothing/Shoe/Accessory Stores
SCWX,SecureWorks Corp. Class A Common Stock,United States,2016.0,Technology,EDP Services
SCYX,SCYNEXIS Inc. Common Stock,United States,2014.0,Health Care,Biotechnology: Pharmaceutical Preparations
SDAC,Sustainable Development Acquisition I Corp. Class A Common Stock,United States,2021.0,,
SDACU,Sustainable Development Acquisition I Corp. Unit,United States,2021.0,,
SDACW,Sustainable Development Acquisition I Corp. Warrant,United States,2021.0,,
SDC,SmileDirectClub Inc. Class A Common Stock,United States,2019.0,Health Care,Medical/Dental Instruments
SDGR,Schrodinger Inc. Common Stock,United States,2020.0,Technology,Computer Software: Prepackaged Software
SDH,Global Internet of People Inc. Ordinary Shares,China,2021.0,Miscellaneous,Business Services
SDIG,Stronghold Digital Mining Inc. Class A Common Stock,United States,2021.0,Finance,Investment Bankers/Brokers/Service
SEAC,SeaChange International Inc. Common Stock,United States,1996.0,Technology,Radio And Television Broadcasting And Communications Equipment
SEAT,Vivid Seats Inc. Class A Common Stock,United States,,Capital Goods,Industrial Machinery/Components
SEATW,Vivid Seats Inc. Warrant,United States,,Capital Goods,Industrial Machinery/Components
SECO,Secoo Holding Limited ADS,China,2017.0,Miscellaneous,Diversified Commercial Services
SEDG,SolarEdge Technologies Inc. Common Stock,Israel,2015.0,Technology,Semiconductors
SEED,Origin Agritech Limited Common Stock,China,,,Farming/Seeds/Milling
SEEL,Seelos Therapeutics Inc. Common Stock,United States,,Health Care,Biotechnology: Pharmaceutical Preparations
SEER,Seer Inc. Class A Common Stock,United States,2020.0,Consumer Durables,Specialty Chemicals
SEIC,SEI Investments Company Common Stock,United States,1981.0,Finance,Investment Bankers/Brokers/Service
SELB,Selecta Biosciences Inc. Common Stock,United States,2016.0,Health Care,Biotechnology: Pharmaceutical Preparations
SELF,Global Self Storage Inc. Common Stock,United States,,Consumer Services,Real Estate Investment Trusts
SENEA,Seneca Foods Corp. Class A Common Stock,United States,,Consumer Non-Durables,Packaged Foods
SENEB,Seneca Foods Corp. Class B Common Stock,United States,,Consumer Non-Durables,Packaged Foods
SERA,Sera Prognostics Inc. Class A Common Stock,United States,2021.0,Health Care,Precision Instruments
SESN,Sesen Bio Inc. Common Stock,United States,2014.0,Health Care,Biotechnology: Pharmaceutical Preparations
SEV,Sono Group N.V. Common Shares,Germany,2021.0,Energy,Industrial Machinery/Components
