Symbol,Name,Country,IPO,Sector,Industry
AACG,ATA Creativity Global American Depositary Shares,China,,Miscellaneous,Service to the Health Industry
AACI,Armada Acquisition Corp. I Common Stock,United States,2021.0,,
AACIU,Armada Acquisition Corp. I Unit,United States,2021.0,,
AACIW,Armada Acquisition Corp. I Warrant,United States,2021.0,,
AADI,Aadi Bioscience Inc. Common Stock,United States,,Health Care,Biotechnology: Pharmaceutical Preparations
AAL,American Airlines Group Inc. Common Stock,United States,,Transportation,Air Freight/Delivery Services
AAME,Atlantic American Corporation Common Stock,United States,,Finance,Life Insurance
AAOI,Applied Optoelectronics Inc. Common Stock,United States,2013.0,Technology,Semiconductors
AAON,AAON Inc. Common Stock,United States,,Capital Goods,Industrial Machinery/Components
AAPL,Apple Inc. Common Stock,United States,1980.0,Technology,Computer Manufacturing
AATC,Autoscope Technologies Corporation Common Stock,United States,,Capital Goods,Industrial Machinery/Components
AAWW,Atlas Air Worldwide Holdings NEW Common Stock,United States,,Transportation,Transportation Services
ABCB,Ameris Bancorp Common Stock,United States,1994.0,Finance,Major Banks
ABCL,AbCellera Biologics Inc. Common Shares,Canada,2020.0,,
ABCM,Abcam plc American Depositary Shares,United Kingdom,2020.0,Health Care,Biotechnology: Biological Products (No Diagnostic Substances)
ABEO,Abeona Therapeutics Inc. Common Stock,United States,,Health Care,Biotechnology: Pharmaceutical Preparations
ABGI,ABG Acquisition Corp. I Class A Ordinary Shares,United States,2021.0,Finance,Business Services
ABIO,ARCA biopharma Inc. Common Stock,United States,,Health Care,Biotechnology: In Vitro & In Vivo Diagnostic Substances
ABMD,ABIOMED Inc. Common Stock,United States,,Health Care,Medical/Dental Instruments
ABNB,Airbnb Inc. Class A Common Stock,United States,2020.0,Capital Goods,Industrial Machinery/Components
ABOS,Acumen Pharmaceuticals Inc. Common Stock,United States,2021.0,Health Care,Biotechnology: Pharmaceutical Preparations
ABSI,Absci Corporation Common Stock,United States,2021.0,Health Care,Biotechnology: Pharmaceutical Preparations
ABST,Absolute Software Corporation Common Stock,Canada,2020.0,,
ABTX,Allegiance Bancshares Inc. Common Stock,United States,2015.0,Finance,Major Banks
ABUS,Arbutus Biopharma Corporation Common Stock,Canada,,,
ABVC,ABVC BioPharma Inc. Common Stock,United States,,Health Care,Biotechnology: Pharmaceutical Preparations
ACAD,ACADIA Pharmaceuticals Inc. Common Stock,United States,1985.0,Health Care,Biotechnology: Pharmaceutical Preparations
ACAH,Atlantic Coastal Acquisition Corp. Class A Common Stock,United States,2021.0,,
ACAHU,Atlantic Coastal Acquisition Corp. Unit,United States,2021.0,,
ACAHW,Atlantic Coastal Acquisition Corp. Warrant,United States,2021.0,,
ACB,Aurora Cannabis Inc. Common Shares,Canada,,,
ACBA,Ace Global Business Acquisition Limited Ordinary Shares,Hong Kong,2021.0,Miscellaneous,Business Services
ACBAU,Ace Global Business Acquisition Limited Unit,Hong Kong,2021.0,Miscellaneous,Business Services
ACBAW,Ace Global Business Acquisition Limited Warrant,Hong Kong,2021.0,Finance,Business Services
ACBI,Atlantic Capital Bancshares Inc. Common Stock,United States,,Finance,Major Banks
ACCD,Accolade Inc. Common Stock,United States,2020.0,,
ACER,Acer Therapeutics Inc. Common Stock (DE),United States,,Health Care,Biotechnology: Biological Products (No Diagnostic Substances)
ACET,Adicet Bio Inc. Common Stock ,United States,2018.0,Health Care,Biotechnology: Pharmaceutical Preparations
ACEV,ACE Convergence Acquisition Corp. Class A Ordinary Shares,United States,2020.0,Technology,Semiconductors
ACEVU,ACE Convergence Acquisition Corp. Unit,United States,2020.0,Technology,Semiconductors
ACEVW,ACE Convergence Acquisition Corp. Warrant,United States,2020.0,Technology,Semiconductors
ACGL,Arch Capital Group Ltd. Common Stock,Bermuda,,Finance,Property-Casualty Insurers
ACGLN,Arch Capital Group Ltd. Depositary Shares each Representing a 1/1000th Interest in a 4.550% Non-Cumulative Preferred Share Series G,Bermuda,,Finance,Property-Casualty Insurers
ACGLO,Arch Capital Group Ltd. Depositary Shares Each Representing 1/1000th Interest in a Share of 5.45% Non-Cumulative Preferred Shares Series F,Bermuda,,Finance,Property-Casualty Insurers
ACHC,Acadia Healthcare Company Inc. Common Stock,United States,,Health Care,Hospital/Nursing Management
ACHL,Achilles Therapeutics plc American Depositary Shares,United Kingdom,2021.0,Health Care,Biotechnology: Biological Products (No Diagnostic Substances)
ACHV,Achieve Life Sciences Inc. Common Shares,United States,,Health Care,Biotechnology: In Vitro & In Vivo Diagnostic Substances
ACIU,AC Immune SA Common Stock,Switzerland,2016.0,Health Care,Biotechnology: Pharmaceutical Preparations
ACIW,ACI Worldwide Inc. Common Stock,United States,,Technology,EDP Services
ACKIT,Ackrell SPAC Partners I Co. Subunits,United States,2021.0,,
ACKIU,Ackrell SPAC Partners I Co. Units,United States,2020.0,,
ACKIW,Ackrell SPAC Partners I Co. Warrants,United States,2021.0,,
ACLS,Axcelis Technologies Inc. Common Stock,United States,2000.0,Technology,Industrial Machinery/Components
ACMR,ACM Research Inc. Class A Common Stock,United States,2017.0,Technology,Industrial Machinery/Components
ACNB,ACNB Corporation Common Stock,United States,,Finance,Major Banks
ACOR,Acorda Therapeutics Inc. Common Stock,United States,2006.0,Health Care,Biotechnology: Biological Products (No Diagnostic Substances)
ACQR,Independence Holdings Corp. Class A Ordinary Share,United States,2021.0,Finance,Business Services
ACQRU,Independence Holdings Corp. Units,United States,2021.0,Finance,Business Services
ACQRW,Independence Holdings Corp. Warrant,United States,2021.0,Finance,Business Services
ACRS,Aclaris Therapeutics Inc. Common Stock,United States,2015.0,Health Care,Biotechnology: Pharmaceutical Preparations
ACRX,AcelRx Pharmaceuticals Inc. Common Stock,United States,2011.0,Consumer Durables,Specialty Chemicals
ACST,Acasti Pharma Inc. Class A Common Stock,Canada,,,
ACT,Enact Holdings Inc. Common Stock,United States,2021.0,Finance,Specialty Insurers
ACTD,ArcLight Clean Transition Corp. II Class A Ordinary Share,United States,2021.0,,
ACTDU,ArcLight Clean Transition Corp. II Unit,United States,2021.0,,
ACTDW,ArcLight Clean Transition Corp. II Warrant,United States,2021.0,Finance,Business Services
ACTG,Acacia Research Corporation (Acacia Tech) Common Stock,United States,,Miscellaneous,Multi-Sector Companies
ACVA,ACV Auctions Inc. Class A Common Stock,United States,2021.0,Technology,EDP Services
ACXP,Acurx Pharmaceuticals Inc. Common Stock,United States,2021.0,Health Care,Biotechnology: Pharmaceutical Preparations
ADAG,Adagene Inc. American Depositary Shares,China,2021.0,Health Care,Biotechnology: Pharmaceutical Preparations
ADALU,Anthemis Digital Acquisitions I Corp Unit,United States,2021.0,,
ADAP,Adaptimmune Therapeutics plc American Depositary Shares,United Kingdom,2015.0,Health Care,Biotechnology: Biological Products (No Diagnostic Substances)
ADBE,Adobe Inc. Common Stock,United States,1986.0,Technology,Computer Software: Prepackaged Software
ADER,26 Capital Acquisition Corp. Class A Common Stock,United States,2021.0,,
ADERW,26 Capital Acquisition Corp. Warrant,United States,2021.0,,
ADES,Advanced Emissions Solutions Inc. Common Stock,United States,,Basic Industries,Industrial Specialties
ADGI,Adagio Therapeutics Inc. Common Stock,United States,2021.0,Health Care,Biotechnology: Pharmaceutical Preparations
ADI,Analog Devices Inc. Common Stock,United States,,Technology,Semiconductors
ADIL,Adial Pharmaceuticals Inc Common Stock,United States,2018.0,Health Care,Biotechnology: Pharmaceutical Preparations
ADILW,Adial Pharmaceuticals Inc Warrant,United States,2018.0,Health Care,Biotechnology: Pharmaceutical Preparations
ADMA,ADMA Biologics Inc Common Stock,United States,,Health Care,Biotechnology: Pharmaceutical Preparations
ADMP,Adamis Pharmaceuticals Corporation Common Stock,United States,,Health Care,Biotechnology: Pharmaceutical Preparations
ADMS,Adamas Pharmaceuticals Inc. Common Stock,United States,2014.0,Health Care,Biotechnology: Pharmaceutical Preparations
ADN,Advent Technologies Holdings Inc. Class A Common Stock,United States,2018.0,,
ADNWW,Advent Technologies Holdings Inc. Warrant,United States,2018.0,,
ADOC,Edoc Acquisition Corp. Class A Ordinary Share,United States,2020.0,Finance,Business Services
ADOCR,Edoc Acquisition Corp. Right,United States,2020.0,Finance,Business Services
ADOCW,Edoc Acquisition Corp. Warrant,United States,2020.0,Finance,Business Services
ADP,Automatic Data Processing Inc. Common Stock,United States,,Miscellaneous,Business Services
ADPT,Adaptive Biotechnologies Corporation Common Stock,United States,2019.0,Health Care,Biotechnology: Biological Products (No Diagnostic Substances)
ADSK,Autodesk Inc. Common Stock,United States,,Technology,Computer Software: Prepackaged Software
ADTN,ADTRAN Inc. Common Stock,United States,1994.0,Capital Goods,Telecommunications Equipment
ADTX,Aditxt Inc. Common Stock,United States,2020.0,Consumer Durables,Specialty Chemicals
ADUS,Addus HomeCare Corporation Common Stock,United States,2009.0,Health Care,Medical/Nursing Services
ADV,Advantage Solutions Inc. Class A Common Stock,United States,2019.0,Technology,Advertising
ADVM,Adverum Biotechnologies Inc. Common Stock,United States,2014.0,Health Care,Biotechnology: Pharmaceutical Preparations
ADVWW,Advantage Solutions Inc. Warrant,United States,2019.0,Technology,Advertising
ADXN,Addex Therapeutics Ltd American Depositary Shares,Switzerland,,Health Care,Biotechnology: Pharmaceutical Preparations
ADXS,Advaxis Inc. Common Stock,United States,,Health Care,Biotechnology: Pharmaceutical Preparations
AEAC,Authentic Equity Acquisition Corp. Class A ordinary share,United States,2021.0,Finance,Business Services
AEACU,Authentic Equity Acquisition Corp. Unit,United States,2021.0,Finance,Business Services
AEACW,Authentic Equity Acquisition Corp. Warrant,United States,2021.0,Finance,Business Services
AEAEU,AltEnergy Acquisition Corp. Unit,United States,2021.0,,
AEHA,Aesther Healthcare Acquisition Corp Class A Common Stock,United States,2021.0,,
AEHAW,Aesther Healthcare Acquisition Corp Warrants,United States,2021.0,,
AEHL,Antelope Enterprise Holdings Limited Common Stock (0.024 par),China,,Capital Goods,Building Products
AEHR,Aehr Test Systems Common Stock,United States,1997.0,Capital Goods,Electrical Products
AEI,Alset EHome International Inc. Common Stock,United States,2020.0,Consumer Services,Building operators
AEIS,Advanced Energy Industries Inc. Common Stock,United States,1995.0,Consumer Durables,Electrical Products
AEMD,Aethlon Medical Inc. Common Stock,United States,,Miscellaneous,Diversified Commercial Services
AEP,American Electric Power Company Inc. Common Stock,United States,,Public Utilities,Electric Utilities: Central
AEPPL,American Electric Power Company Inc. Corporate Unit,United States,,Public Utilities,Electric Utilities: Central
AEPPZ,American Electric Power Company Inc. Corporate Units,United States,,Public Utilities,Electric Utilities: Central
AERC,AeroClean Technologies Inc. Common Stock,United States,,,
AERI,Aerie Pharmaceuticals Inc. Common Stock,United States,2013.0,Health Care,Biotechnology: Biological Products (No Diagnostic Substances)
AESE,Allied Esports Entertainment Inc. Common Stock,United States,2017.0,Consumer Services,Television Services
AEY,ADDvantage Technologies Group Inc. Common Stock,United States,,Capital Goods,Recreational Products/Toys
AEYE,AudioEye Inc. Common Stock,United States,,Technology,EDP Services
AEZS,Aeterna Zentaris Inc. Common Stock,Canada,,,
AFACU,Arena Fortify Acquisition Corp. Unit,United States,2021.0,Consumer Services,Other Pharmaceuticals
AFAQ,AF Acquisition Corp. Class A Common Stock,United States,2021.0,,
AFAQU,AF Acquisition Corp. Units,United States,2021.0,,
AFAQW,AF Acquisition Corp. Warrants,United States,2021.0,,
AFBI,Affinity Bancshares Inc. Common Stock (MD),United States,2017.0,Finance,Major Banks
AFCG,AFC Gamma Inc. Common Stock,United States,2021.0,Consumer Services,Real Estate Investment Trusts
AFIB,Acutus Medical Inc. Common Stock,United States,2020.0,Health Care,Biotechnology: Electromedical & Electrotherapeutic Apparatus
AFIN,American Finance Trust Inc. Class A Common Stock,United States,,Consumer Services,Real Estate Investment Trusts
AFINO,American Finance Trust Inc. 7.375% Series C Cumulative Redeemable Preferred Stock,United States,,Consumer Services,Real Estate Investment Trusts
AFINP,American Finance Trust Inc. 7.50% Series A Cumulative Redeemable Perpetual Preferred Stock,United States,,Consumer Services,Real Estate Investment Trusts
AFMD,Affimed N.V.,Germany,2014.0,Health Care,Biotechnology: Pharmaceutical Preparations
AFRM,Affirm Holdings Inc. Class A Common Stock,United States,2021.0,Technology,EDP Services
AFYA,Afya Limited Class A Common Shares,Brazil,2019.0,Consumer Services,Other Consumer Services
AGBA,AGBA Acquisition Limited Ordinary Share,Hong Kong,2019.0,Finance,Business Services
AGBAR,AGBA Acquisition Limited Right,Hong Kong,2019.0,Finance,Business Services
AGBAW,AGBA Acquisition Limited Warrant,Hong Kong,2019.0,Finance,Business Services
AGC,Altimeter Growth Corp. Class A Ordinary Shares,United States,2020.0,,
AGCUU,Altimeter Growth Corp. Unit,United States,2020.0,Finance,Business Services
AGCWW,Altimeter Growth Corp. Warrant,United States,2020.0,Finance,Business Services
AGEN,Agenus Inc. Common Stock,United States,2000.0,Health Care,Biotechnology: Biological Products (No Diagnostic Substances)
AGFS,AgroFresh Solutions Inc. Common Stock,United States,2014.0,,
AGFY,Agrify Corporation Common Stock,United States,2021.0,Consumer Services,Military/Government/Technical
AGGR,Agile Growth Corp. Class A Ordinary Share,United States,2021.0,Finance,Business Services
AGGRU,Agile Growth Corp. Units,United States,2021.0,Finance,Business Services
AGGRW,Agile Growth Corp. Warrant.,United States,2021.0,Finance,Business Services
AGIL,AgileThought Inc. Class A Common Stock,United States,2020.0,Technology,EDP Services
AGILW,AgileThought Inc. Warrant,United States,2020.0,Technology,EDP Services
AGIO,Agios Pharmaceuticals Inc. Common Stock,United States,2013.0,Health Care,Biotechnology: Pharmaceutical Preparations
AGLE,Aeglea BioTherapeutics Inc. Common Stock,United States,2016.0,Health Care,Biotechnology: Pharmaceutical Preparations
AGMH,AGM Group Holdings Inc. Class A Ordinary Shares,Hong Kong,2018.0,Technology,EDP Services
AGNC,AGNC Investment Corp. Common Stock,United States,2008.0,Consumer Services,Real Estate Investment Trusts
AGNCM,AGNC Investment Corp. Depositary Shares rep 6.875% Series D Fixed-to-Floating Cumulative Redeemable Preferred Stock,United States,,Consumer Services,Real Estate Investment Trusts
AGNCN,AGNC Investment Corp. Depositary Shares Each Representing a 1/1000th Interest in a Share of 7.00% Series C Fixed-To-Floating Rate Cumulative Redeemable Preferred Stock,United States,,Consumer Services,Real Estate Investment Trusts
AGNCO,AGNC Investment Corp. Depositary Shares each representing a 1/1000th interest in a share of 6.50% Series E Fixed-to-Floating Cumulative Redeemable Preferred Stock,United States,,Consumer Services,Real Estate Investment Trusts
AGNCP,AGNC Investment Corp. Depositary Shares Each Representing a 1/1000th Interest in a Share of 6.125% Series F Fixed-to-Floating Rate Cumulative Redeemable Preferred Stock,United States,,Consumer Services,Real Estate Investment Trusts
AGRI,AgriFORCE  Growing Systems Ltd. Common Shares,Canada,2021.0,,
AGRIW,AgriFORCE  Growing Systems Ltd. Warrant,Canada,2021.0,,
AGRX,Agile Therapeutics Inc. Common Stock,United States,2014.0,Health Care,Biotechnology: Pharmaceutical Preparations
AGTC,Applied Genetic Technologies Corporation Common Stock,United States,2014.0,Health Care,Biotechnology: Biological Products (No Diagnostic Substances)
AGYS,Agilysys Inc. Common Stock,United States,,Technology,Computer Software: Prepackaged Software
AHCO,AdaptHealth Corp. Common Stock,United States,2018.0,Health Care,Biotechnology: Electromedical & Electrotherapeutic Apparatus
AHI,Advanced Human Imaging Limited. American Depositary Shares,Australia,2021.0,,
AHPA,Avista Public Acquisition Corp. II Class A Ordinary Shares,United States,2021.0,,
AHPAU,Avista Public Acquisition Corp. II Unit,United States,2021.0,,
AHPAW,Avista Public Acquisition Corp. II Warrant,United States,2021.0,,
AHPI,Allied Healthcare Products Inc. Common Stock,United States,1992.0,Health Care,Industrial Specialties
AIH,Aesthetic Medical International Holdings Group Ltd. American Depositary Shares,China,2019.0,Health Care,Medical Specialities
AIHS,Senmiao Technology Limited Common Stock,China,2018.0,Finance,Finance: Consumer Services
AIKI,AIkido Pharma Inc. Common Stock,United States,,Consumer Durables,Specialty Chemicals
AIMC,Altra Industrial Motion Corp. Common Stock,United States,2006.0,Capital Goods,Industrial Machinery/Components
AINV,Apollo Investment Corporation Common Stock,United States,2004.0,Finance,Finance/Investors Services
AIP,Arteris Inc. Common Stock,United States,2021.0,Technology,Semiconductors
AIRG,Airgain Inc. Common Stock,United States,2016.0,Technology,Radio And Television Broadcasting And Communications Equipment
AIRS,AirSculpt Technologies Inc. Common Stock,United States,2021.0,Health Care,Hospital/Nursing Management
AIRT,Air T Inc. Common Stock,United States,,Transportation,Air Freight/Delivery Services
AIRTP,Air T Inc. Air T Funding Alpha Income Trust Preferred Securities,United States,,Transportation,Air Freight/Delivery Services
AKAM,Akamai Technologies Inc. Common Stock,United States,1999.0,Miscellaneous,Business Services
AKBA,Akebia Therapeutics Inc. Common Stock,United States,2014.0,Health Care,Biotechnology: Pharmaceutical Preparations
AKIC,Sports Ventures Acquisition Corp. Class A Ordinary Shares,United States,2021.0,Finance,Business Services
AKICU,Sports Ventures Acquisition Corp. Unit,United States,2021.0,Finance,Business Services
AKICW,Sports Ventures Acquisition Corp. Warrant,United States,2021.0,Finance,Business Services
AKRO,Akero Therapeutics Inc. Common Stock,United States,2019.0,Health Care,Biotechnology: Pharmaceutical Preparations
AKTS,Akoustis Technologies Inc. Common Stock,United States,,Public Utilities,Telecommunications Equipment
AKTX,Akari Therapeutics plc ADS,United Kingdom,,Health Care,Biotechnology: Pharmaceutical Preparations
AKU,Akumin Inc. Common Shares,Canada,,,
AKUS,Akouos Inc. Common Stock,United States,2020.0,Consumer Durables,Specialty Chemicals
AKYA,Akoya BioSciences Inc. Common Stock,United States,2021.0,Capital Goods,Medical Specialities
ALAC,Alberton Acquisition Corporation Ordinary Shares,Hong Kong,2018.0,Basic Industries,Engineering & Construction
ALACR,Alberton Acquisition Corporation Rights exp April 26 2021,Hong Kong,2018.0,Finance,Business Services
ALACW,Alberton Acquisition Corporation Warrant,Hong Kong,2018.0,Basic Industries,Engineering & Construction
ALBO,Albireo Pharma Inc. Common Stock,United States,,Health Care,Biotechnology: Pharmaceutical Preparations
ALCO,Alico Inc. Common Stock,United States,,,
ALDX,Aldeyra Therapeutics Inc. Common Stock,United States,2014.0,Health Care,Biotechnology: Pharmaceutical Preparations
ALEC,Alector Inc. Common Stock,United States,2019.0,Health Care,Biotechnology: Pharmaceutical Preparations
ALF,ALFI Inc. Common Stock,United States,2021.0,Technology,EDP Services
ALFIW,ALFI Inc. Warrant,United States,2021.0,Technology,EDP Services
ALGM,Allegro MicroSystems Inc. Common Stock,United States,2020.0,Technology,Semiconductors
ALGN,Align Technology Inc. Common Stock,United States,2001.0,Health Care,Industrial Specialties
ALGS,Aligos Therapeutics Inc. Common Stock,United States,2020.0,Health Care,Biotechnology: Pharmaceutical Preparations
ALGT,Allegiant Travel Company Common Stock,United States,2006.0,Transportation,Air Freight/Delivery Services
ALHC,Alignment Healthcare Inc. Common Stock,United States,2021.0,Health Care,Medical Specialities
ALIM,Alimera Sciences Inc. Common Stock,United States,2010.0,Health Care,Biotechnology: Pharmaceutical Preparations
ALJJ,ALJ Regional Holdings Inc. Common Stock,United States,,Miscellaneous,Business Services
ALKS,Alkermes plc Ordinary Shares,Ireland,1991.0,Health Care,Biotechnology: Pharmaceutical Preparations
ALKT,Alkami Technology Inc. Common Stock,United States,2021.0,Technology,EDP Services
ALLK,Allakos Inc. Common Stock,United States,2018.0,Health Care,Biotechnology: Pharmaceutical Preparations
ALLO,Allogene Therapeutics Inc. Common Stock,United States,2018.0,Health Care,Biotechnology: Biological Products (No Diagnostic Substances)
ALLT,Allot Ltd. Ordinary Shares,Israel,2006.0,Public Utilities,Telecommunications Equipment
ALNA,Allena Pharmaceuticals Inc. Common Stock,United States,2017.0,Health Care,Biotechnology: Pharmaceutical Preparations
ALNY,Alnylam Pharmaceuticals Inc. Common Stock,United States,2004.0,Health Care,Biotechnology: Pharmaceutical Preparations
ALORU,ALSP Orchid Acquisition Corporation I Unit,United States,2021.0,,
ALOT,AstroNova Inc. Common Stock,United States,1983.0,Technology,Computer peripheral equipment
ALPA,Alpha Healthcare Acquisition Corp. III Class A Common Stock,United States,2021.0,,
ALPN,Alpine Immune Sciences Inc. Common Stock,United States,2015.0,Health Care,Biotechnology: Pharmaceutical Preparations
ALPP,Alpine 4 Holdings Inc. Class A Common Stock,United States,,Capital Goods,Metal Fabrications
ALRM,Alarm.com Holdings Inc. Common Stock,United States,2015.0,Technology,Computer Software: Prepackaged Software
ALRN,Aileron Therapeutics Inc. Common Stock,United States,2017.0,Health Care,Biotechnology: Pharmaceutical Preparations
ALRS,Alerus Financial Corporation Common Stock,United States,2019.0,Finance,Commercial Banks
ALT,Altimmune Inc. Common Stock,United States,,Health Care,Biotechnology: Pharmaceutical Preparations
ALTM,Altus Midstream Company Class A Common Stock,United States,2017.0,Energy,Oil & Gas Production
ALTO,Alto Ingredients Inc. Common Stock,United States,,Basic Industries,Industrial Specialties
ALTR,Altair Engineering Inc. Class A Common Stock,United States,2017.0,Technology,Computer Software: Prepackaged Software
ALTU,Altitude Acquisition Corp. Class A Common Stock,United States,2021.0,,
ALTUU,Altitude Acquisition Corp. Unit,United States,2020.0,,
ALTUW,Altitude Acquisition Corp. Warrant,United States,2021.0,,
ALVR,AlloVir Inc. Common Stock,United States,2020.0,Health Care,Biotechnology: Pharmaceutical Preparations
ALXO,ALX Oncology Holdings Inc. Common Stock,United States,2020.0,Health Care,Biotechnology: Pharmaceutical Preparations
ALYA,Alithya Group inc. Class A Subordinate Voting Shares,Canada,,,
ALZN,Alzamend Neuro Inc. Common Stock,United States,2021.0,Consumer Durables,Specialty Chemicals
AMAL,Amalgamated Financial Corp. Common Stock (DE),United States,2018.0,Finance,Commercial Banks
AMAO,American Acquisition Opportunity Inc. Class A Common Stock,United States,2021.0,,
AMAOU,American Acquisition Opportunity Inc. Units,United States,2021.0,,
AMAOW,American Acquisition Opportunity Inc. Warrant,United States,2021.0,Finance,Business Services
AMAT,Applied Materials Inc. Common Stock,United States,1972.0,Capital Goods,Industrial Machinery/Components
AMBA,Ambarella Inc. Ordinary Shares,United States,2012.0,Technology,Semiconductors
AMCI,AMCI Acquisition Corp. II Class A Common Stock,United States,2021.0,,
AMCIU,AMCI Acquisition Corp. II Units,United States,2021.0,,
AMCIW,AMCI Acquisition Corp. II Warrant,United States,2021.0,,
AMCX,AMC Networks Inc. Class A Common Stock,United States,,Consumer Services,Broadcasting
AMD,Advanced Micro Devices Inc. Common Stock,United States,,Technology,Semiconductors
AMED,Amedisys Inc Common Stock,United States,,Health Care,Medical/Nursing Services
AMEH,Apollo Medical Holdings Inc. Common Stock,United States,,Health Care,Managed Health Care
AMGN,Amgen Inc. Common Stock,United States,1983.0,Health Care,Biotechnology: Pharmaceutical Preparations
AMKR,Amkor Technology Inc. Common Stock,United States,1998.0,Technology,Semiconductors
AMNB,American National Bankshares Inc. Common Stock,United States,,Finance,Major Banks
AMOT,Allied Motion Technologies Inc.,United States,,Capital Goods,Electrical Products
AMPG,Amplitech Group Inc. Common Stock,United States,,Capital Goods,Industrial Machinery/Components
AMPGW,Amplitech Group Inc. Warrants,United States,,Capital Goods,Industrial Machinery/Components
AMPH,Amphastar Pharmaceuticals Inc. Common Stock,United States,2014.0,Health Care,Biotechnology: Pharmaceutical Preparations
AMPL,Amplitude Inc. Class A Common Stock,United States,,Technology,EDP Services
AMRK,A-Mark Precious Metals Inc. Common Stock,United States,,Finance,Investment Bankers/Brokers/Service
AMRN,Amarin Corporation plc,Ireland,,Health Care,Biotechnology: Pharmaceutical Preparations
AMRS,Amyris Inc. Common Stock,United States,2010.0,Basic Industries,Industrial Specialties
AMSC,American Superconductor Corporation Common Stock,United States,1991.0,Capital Goods,Office Equipment/Supplies/Services
AMSF,AMERISAFE Inc. Common Stock,United States,2005.0,Finance,Accident &Health Insurance
AMST,Amesite Inc. Common Stock,United States,2020.0,Technology,Computer Software: Prepackaged Software
AMSWA,American Software Inc. Class A Common Stock,United States,,Technology,Computer Software: Prepackaged Software
AMTB,Amerant Bancorp Inc. Class A Common Stock,United States,,Finance,Major Banks
AMTI,Applied Molecular Transport Inc. Common Stock,United States,2020.0,Consumer Durables,Specialty Chemicals
AMTX,Aemetis Inc. Common Stock,United States,,Energy,Oilfield Services/Equipment
AMWD,American Woodmark Corporation Common Stock,United States,1986.0,Consumer Durables,Building Products
AMYT,Amryt Pharma plc American Depositary Shares,United Kingdom,,Health Care,Biotechnology: Pharmaceutical Preparations
