Symbol,Name,Country,IPO,Sector,Industry
IIVIP,II-VI Incorporated 6.00% Series A Mandatory Convertible Preferred Stock,United States,,Capital Goods,Industrial Machinery/Components
IKNA,Ikena Oncology Inc. Common Stock,United States,2021.0,Health Care,Biotechnology: Pharmaceutical Preparations
IKNX,Ikonics Corporation,United States,,Miscellaneous,Industrial Machinery/Components
IKT,Inhibikase Therapeutics Inc. Common Stock,United States,2020.0,Health Care,Biotechnology: Pharmaceutical Preparations
ILMN,Illumina Inc. Common Stock,United States,2000.0,Health Care,Medical Specialities
ILPT,Industrial Logistics Properties Trust Common Shares of Beneficial Interest,United States,2018.0,Consumer Services,Real Estate Investment Trusts
IMAB,I-MAB American Depositary Shares,China,2020.0,Health Care,Biotechnology: Pharmaceutical Preparations
IMAC,IMAC Holdings Inc. Common Stock,United States,2019.0,Health Care,Medical Specialities
IMACW,IMAC Holdings Inc. Warrant,United States,2019.0,Health Care,Medical Specialities
IMAQ,International Media Acquisition Corp. Class A Common Stock,United States,2021.0,,
IMAQR,International Media Acquisition Corp. Rights,United States,2021.0,,
IMAQU,International Media Acquisition Corp. Unit,United States,2021.0,,
IMAQW,International Media Acquisition Corp. Warrants,United States,2021.0,,
IMBI,iMedia Brands Inc. Class A Common Stock,United States,,Consumer Services,Catalog/Specialty Distribution
IMBIL,iMedia Brands Inc. 8.5% Senior Notes Due 2026,United States,,,
IMCC,IM Cannabis Corp. Common Shares,Canada,,,
IMCR,Immunocore Holdings plc American Depositary Shares,United Kingdom,2021.0,Health Care,Biotechnology: Biological Products (No Diagnostic Substances)
IMGN,ImmunoGen Inc. Common Stock,United States,1989.0,Health Care,Biotechnology: Pharmaceutical Preparations
IMGO,Imago BioSciences Inc. Common stock,United States,2021.0,Health Care,Biotechnology: Pharmaceutical Preparations
IMKTA,Ingles Markets Incorporated Class A Common Stock,United States,1987.0,Consumer Services,Food Chains
IMMP,Immutep Limited American Depositary Shares,Australia,,Health Care,Biotechnology: Pharmaceutical Preparations
IMMR,Immersion Corporation Common Stock,United States,1999.0,Technology,Computer peripheral equipment
IMNM,Immunome Inc. Common Stock,United States,2020.0,Consumer Durables,Specialty Chemicals
IMOS,ChipMOS TECHNOLOGIES INC. American Depositary Shares,Taiwan,,Technology,Semiconductors
IMPL,Impel NeuroPharma Inc. Common Stock,United States,2021.0,Health Care,Biotechnology: Pharmaceutical Preparations
IMRA,IMARA Inc. Common Stock,United States,2020.0,Health Care,Biotechnology: Biological Products (No Diagnostic Substances)
IMRN,Immuron Limited American Depositary Shares,Australia,2017.0,Health Care,Biotechnology: Pharmaceutical Preparations
IMRNW,Immuron Limited Warrants,Australia,2017.0,Health Care,Biotechnology: Pharmaceutical Preparations
IMRX,Immuneering Corporation Class A Common Stock,United States,2021.0,Health Care,Biotechnology: Pharmaceutical Preparations
IMTE,Integrated Media Technology Limited Ordinary Shares,Australia,,Consumer Non-Durables,Consumer Electronics/Appliances
IMTX,Immatics N.V. Ordinary Shares,Germany,,Health Care,Biotechnology: Biological Products (No Diagnostic Substances)
IMTXW,Immatics N.V. Warrants,Germany,,Health Care,Biotechnology: Biological Products (No Diagnostic Substances)
IMUX,Immunic Inc. Common Stock,United States,2014.0,Health Care,Biotechnology: Pharmaceutical Preparations
IMV,IMV Inc. Common Shares,Canada,,,
IMVT,Immunovant Inc. Common Stock,United States,2019.0,Health Care,Biotechnology: Pharmaceutical Preparations
IMXI,International Money Express Inc. Common Stock,United States,2017.0,Technology,EDP Services
INAB,IN8bio Inc. Common Stock,United States,2021.0,Health Care,Biotechnology: Pharmaceutical Preparations
INBK,First Internet Bancorp Common Stock,United States,,Finance,Major Banks
INBKZ,First Internet Bancorp 6.0% Fixed-to-Floating Rate Subordinated Notes Due 2029,United States,,Finance,Major Banks
INBX,Inhibrx Inc. Common Stock,United States,2020.0,Health Care,Biotechnology: Pharmaceutical Preparations
INCR,Intercure Ltd. Ordinary Shares,Israel,,,
INCY,Incyte Corp. Common Stock,United States,,Health Care,Biotechnology: Commercial Physical & Biological Resarch
INDB,Independent Bank Corp. Common Stock,United States,,Finance,Major Banks
INDI,indie Semiconductor Inc. Class A Common Stock,United States,,Technology,Semiconductors
INDIW,indie Semiconductor Inc. Warrant,United States,,Technology,Semiconductors
INDP,Indaptus Therapeutics Inc. Common Stock,United States,,Health Care,Biotechnology: Pharmaceutical Preparations
INDT,INDUS Realty Trust Inc. (MD) Common Stock,United States,,Finance,Real Estate
INFI,Infinity Pharmaceuticals Inc. Common Stock,United States,,Health Care,Biotechnology: Pharmaceutical Preparations
INFN,Infinera Corporation Common Stock,United States,2007.0,Public Utilities,Telecommunications Equipment
INGN,Inogen Inc Common Stock,United States,2014.0,Health Care,Industrial Specialties
INKA,KludeIn I Acquisition Corp. Class A Common Stock,United States,2021.0,,
INKAW,KludeIn I Acquisition Corp. Warrant,United States,2021.0,,
INKT,MiNK Therapeutics Inc. Common Stock,United States,2021.0,Consumer Durables,Specialty Chemicals
INM,InMed Pharmaceuticals Inc. Common Shares,Canada,,,
INMB,INmune Bio Inc. Common stock,United States,2019.0,Health Care,Biotechnology: Pharmaceutical Preparations
INMD,InMode Ltd. Ordinary Shares,Israel,2019.0,Health Care,Biotechnology: Electromedical & Electrotherapeutic Apparatus
INNV,InnovAge Holding Corp. Common Stock,United States,2021.0,Health Care,Hospital/Nursing Management
INO,Inovio Pharmaceuticals Inc. Common Stock,United States,,Health Care,Biotechnology: Biological Products (No Diagnostic Substances)
INOD,Innodata Inc. Common Stock,United States,1993.0,Technology,EDP Services
INOV,Inovalon Holdings Inc. Class A Common Stock,United States,2015.0,Technology,EDP Services
INPX,Inpixon Common Stock,United States,2014.0,Technology,Computer Software: Prepackaged Software
INSE,Inspired Entertainment Inc. Common Stock,United States,2014.0,,
INSG,Inseego Corp. Common Stock,United States,,Capital Goods,Telecommunications Equipment
INSM,Insmed Inc. Common Stock,United States,,Health Care,Biotechnology: Pharmaceutical Preparations
INTA,Intapp Inc. Common Stock,United States,2021.0,Technology,Computer Software: Prepackaged Software
INTC,Intel Corporation Common Stock,United States,,Technology,Semiconductors
INTEU,Integral Acquisition Corporation 1 Unit,United States,2021.0,,
INTG,Intergroup Corporation (The) Common Stock,United States,,Consumer Services,Hotels/Resorts
INTU,Intuit Inc. Common Stock,United States,1993.0,Technology,Computer Software: Prepackaged Software
INTZ,Intrusion Inc. Common Stock,United States,,Miscellaneous,Diversified Manufacture
INVA,Innoviva Inc. Common Stock,United States,,Health Care,Biotechnology: Pharmaceutical Preparations
INVE,Identiv Inc. Common Stock,United States,,Technology,Computer peripheral equipment
INVO,INVO BioScience Inc. Common Stock,United States,,Health Care,Medical/Dental Instruments
INVZ,Innoviz Technologies Ltd. Ordinary shares,Israel,,Capital Goods,Auto Parts:O.E.M.
INVZW,Innoviz Technologies Ltd. Warrant,Israel,,Capital Goods,Auto Parts:O.E.M.
INZY,Inozyme Pharma Inc. Common Stock,United States,2020.0,Health Care,Biotechnology: Pharmaceutical Preparations
IOACU,Innovative International Acquisition Corp. Unit,United States,2021.0,,
IOBT,IO Biotech Inc. Common Stock,Denmark,2021.0,Health Care,Biotechnology: Pharmaceutical Preparations
IONM,Assure Holdings Corp. Common Stock,United States,,Health Care,Assisted Living Services
IONS,Ionis Pharmaceuticals Inc. Common Stock,United States,,Health Care,Biotechnology: Pharmaceutical Preparations
IOSP,Innospec Inc. Common Stock,United States,,Basic Industries,Industrial Specialties
IOVA,Iovance Biotherapeutics Inc. Common Stock,United States,,Health Care,Biotechnology: Pharmaceutical Preparations
IPA,ImmunoPrecise Antibodies Ltd. Common Stock,Canada,,,
IPAR,Inter Parfums Inc. Common Stock,United States,,Consumer Non-Durables,Package Goods/Cosmetics
IPAX,Inflection Point Acquisition Corp. Class A Ordinary Share,United States,2021.0,,
IPAXU,Inflection Point Acquisition Corp. Units,United States,2021.0,,
IPAXW,Inflection Point Acquisition Corp. Warrants,United States,2021.0,,
IPDN,Professional Diversity Network Inc. Common Stock,United States,2013.0,Technology,EDP Services
IPGP,IPG Photonics Corporation Common Stock,United States,2006.0,Technology,Semiconductors
IPHA,Innate Pharma S.A. ADS,France,2019.0,Health Care,Biotechnology: Pharmaceutical Preparations
IPLDP,Interstate Power & Light Company Perp Prd Ser D,United States,,Public Utilities,Power Generation
IPSC,Century Therapeutics Inc. Common Stock,United States,2021.0,Consumer Durables,Specialty Chemicals
IPVI,InterPrivate IV InfraTech Partners Inc. Class A Common Stock,United States,2021.0,,
IPVIU,InterPrivate IV InfraTech Partners Inc. Units,United States,2021.0,,
IPVIW,InterPrivate IV InfraTech Partners Inc. Warrant,United States,2021.0,,
IPW,iPower Inc. Common Stock,United States,2021.0,Consumer Services,Catalog/Specialty Distribution
IPWR,Ideal Power Inc. Common Stock,United States,2013.0,Capital Goods,Industrial Machinery/Components
IQ,iQIYI Inc. American Depositary Shares,China,2018.0,Technology,Internet and Information Services
IQMDU,Intelligent Medicine Acquisition Corp. Unit,United States,2021.0,,
IRBT,iRobot Corporation Common Stock,United States,2005.0,,
IRCP,IRSA Propiedades Comerciales S.A. American Depositary Shares,Argentina,,Consumer Services,Building operators
IRDM,Iridium Communications Inc Common Stock,United States,,Consumer Services,Telecommunications Equipment
IREN,Iris Energy Limited Ordinary Shares,Australia,2021.0,,
IRIX,IRIDEX Corporation Common Stock,United States,1996.0,Health Care,Biotechnology: Electromedical & Electrotherapeutic Apparatus
IRMD,iRadimed Corporation Common Stock,United States,2014.0,Health Care,Medical/Dental Instruments
IROQ,IF Bancorp Inc. Common Stock,United States,2011.0,Finance,Finance: Consumer Services
IRTC,iRhythm Technologies Inc. Common Stock,United States,2016.0,Health Care,Medical/Dental Instruments
IRWD,Ironwood Pharmaceuticals Inc. Class A Common Stock,United States,2010.0,Health Care,Biotechnology: Pharmaceutical Preparations
ISAA,Iron Spark I Inc. Class A Common Stock,United States,2021.0,,
ISBC,Investors Bancorp Inc. Common Stock,United States,,Finance,Savings Institutions
ISEE,IVERIC bio Inc. Common Stock,United States,2013.0,Health Care,Biotechnology: Pharmaceutical Preparations
ISIG,Insignia Systems Inc. Common Stock,United States,1991.0,Technology,Advertising
ISLE,Isleworth Healthcare Acquisition Corporation Common stock,United States,2021.0,,
ISLEW,Isleworth Healthcare Acquisition Corporation Warrant,United States,2021.0,,
ISO,IsoPlexis Corporation Common Stock,United States,2021.0,Health Care,Biotechnology: Electromedical & Electrotherapeutic Apparatus
ISPC,iSpecimen Inc. Common Stock,United States,2021.0,Health Care,Precision Instruments
ISRG,Intuitive Surgical Inc. Common Stock,United States,2000.0,Health Care,Medical/Dental Instruments
ISSC,Innovative Solutions and Support Inc. Common Stock,United States,2000.0,Capital Goods,Military/Government/Technical
ISTR,Investar Holding Corporation Common Stock,United States,2014.0,Finance,Commercial Banks
ISUN,iSun Inc. Common Stock,United States,2016.0,Technology,Semiconductors
ITCI,Intra-Cellular Therapies Inc. Common Stock,United States,,Health Care,Biotechnology: Pharmaceutical Preparations
ITHX,ITHAX Acquisition Corp. Class A Ordinary Shares,United States,2021.0,Finance,Business Services
ITHXU,ITHAX Acquisition Corp. Unit,United States,2021.0,Finance,Business Services
ITHXW,ITHAX Acquisition Corp. Warrant,United States,2021.0,Finance,Business Services
ITI,Iteris Inc. Common Stock,United States,,Capital Goods,Telecommunications Equipment
ITIC,Investors Title Company Common Stock,United States,,Finance,Specialty Insurers
ITMR,Itamar Medical Ltd. American Depository Shares,Israel,,Health Care,Medical/Dental Instruments
ITOS,iTeos Therapeutics Inc. Common Stock,United States,2020.0,Consumer Durables,Specialty Chemicals
ITQ,Itiquira Acquisition Corp. Class A Ordinary Shares,United States,2021.0,Finance,Business Services
ITQRU,Itiquira Acquisition Corp. Unit,United States,2021.0,Finance,Business Services
ITQRW,Itiquira Acquisition Corp. Warrant,United States,2021.0,Finance,Business Services
ITRI,Itron Inc. Common Stock,United States,1993.0,Capital Goods,Electrical Products
ITRM,Iterum Therapeutics plc Ordinary Share,Ireland,2018.0,Health Care,Biotechnology: Pharmaceutical Preparations
ITRN,Ituran Location and Control Ltd. Ordinary Shares,Israel,2005.0,Technology,Electronic Components
IVA,Inventiva S.A. American Depository Shares,France,2020.0,Consumer Services,Other Consumer Services
IVAC,Intevac Inc. Common Stock,United States,1995.0,,
IXAQU,IX Acquisition Corp. Unit,United Kingdom,2021.0,,
IZEA,IZEA Worldwide Inc. Common Stock,United States,,Technology,Advertising
JACK,Jack In The Box Inc. Common Stock,United States,,Consumer Services,Restaurants
JAGX,Jaguar Health Inc. Common Stock,United States,2015.0,Health Care,Biotechnology: Pharmaceutical Preparations
JAKK,JAKKS Pacific Inc. Common Stock,United States,1996.0,Consumer Non-Durables,Recreational Products/Toys
JAMF,Jamf Holding Corp. Common Stock,United States,2020.0,Technology,Computer Software: Prepackaged Software
JAN,JanOne Inc. Common Stock (NV),United States,,Public Utilities,Environmental Services
JANX,Janux Therapeutics Inc. Common Stock,United States,2021.0,Health Care,Biotechnology: Pharmaceutical Preparations
JAQC,Jupiter Acquisition Corporation Common stock,United States,2021.0,,
JAQCU,Jupiter Acquisition Corporation Units,United States,2021.0,,
JAQCW,Jupiter Acquisition Corporation Warrants,United States,2021.0,,
JAZZ,Jazz Pharmaceuticals plc Common Stock (Ireland),Ireland,2007.0,Health Care,Biotechnology: Pharmaceutical Preparations
JBHT,J.B. Hunt Transport Services Inc. Common Stock,United States,,Transportation,Trucking Freight/Courier Services
JBLU,JetBlue Airways Corporation Common Stock,United States,2002.0,Transportation,Air Freight/Delivery Services
JBSS,John B. Sanfilippo & Son Inc. Common Stock,United States,1991.0,Consumer Non-Durables,Specialty Foods
JCIC,Jack Creek Investment Corp. Class A Ordinary Shares,United States,2021.0,Finance,Business Services
JCICU,Jack Creek Investment Corp. Units,United States,2021.0,Finance,Business Services
JCICW,Jack Creek Investment Corp. Warrants,United States,2021.0,Finance,Business Services
JCS,Communications Systems Inc. Common Stock,United States,,Public Utilities,Telecommunications Equipment
JCTCF,Jewett-Cameron Trading Company Common Shares,United States,,,
JD,JD.com Inc. American Depositary Shares,China,2014.0,Miscellaneous,Diversified Commercial Services
JFIN,Jiayin Group Inc. American Depositary Shares,China,2019.0,Finance,Finance: Consumer Services
JFU,9F Inc. American Depositary Shares,China,2019.0,Finance,Finance: Consumer Services
JG,Aurora Mobile Limited American Depositary Shares,China,2018.0,Technology,EDP Services
JJSF,J & J Snack Foods Corp. Common Stock,United States,1986.0,Consumer Non-Durables,Specialty Foods
JKHY,Jack Henry & Associates Inc. Common Stock,United States,1985.0,Technology,Retail: Computer Software & Peripheral Equipment
JMACU,Maxpro Capital Acquisition Corp. Units,Taiwan,2021.0,,
JMPNZ,JMP Group LLC 6.875% Senior Notes due 2029,United States,,Finance,Investment Bankers/Brokers/Service
JNCE,Jounce Therapeutics Inc. Common Stock,United States,2017.0,Health Care,Biotechnology: Pharmaceutical Preparations
JOAN,JOANN Inc. Common Stock,United States,2021.0,Consumer Services,Other Specialty Stores
JOBS,51job Inc. American Depositary Shares,China,2004.0,Technology,Diversified Commercial Services
JOFF,JOFF Fintech Acquisition Corp. Class A Common Stock,United States,2021.0,,
JOFFU,JOFF Fintech Acquisition Corp. Unit,United States,2021.0,,
JOFFW,JOFF Fintech Acquisition Corp. Warrant,United States,2021.0,,
JOUT,Johnson Outdoors Inc. Class A Common Stock,United States,,Consumer Non-Durables,Recreational Products/Toys
JRJC,China Finance Online Co. Limited American Depositary Shares,China,2004.0,Finance,Investment Bankers/Brokers/Service
JRSH,Jerash Holdings (US) Inc. Common Stock,United States,2018.0,Basic Industries,Industrial Specialties
JRVR,James River Group Holdings Ltd. Common Shares,Bermuda,2014.0,Finance,Property-Casualty Insurers
JSM,Navient Corporation 6% Senior Notes due December 15 2043,United States,,Finance,Finance: Consumer Services
JSPR,Jasper Therapeutics Inc. Common Stock,United States,2020.0,Health Care,Biotechnology: Pharmaceutical Preparations
JSPRW,Japer Therapeutics Inc. Warrants,United States,2020.0,Health Care,Biotechnology: Pharmaceutical Preparations
JUGG,Jaws Juggernaut Acquisition Corporation Class A Ordinary Share,United States,2021.0,,
JUGGU,Jaws Juggernaut Acquisition Corporation Unit,United States,2021.0,,
JUGGW,Jaws Juggernaut Acquisition Corporation Warrant,United States,2021.0,,
JUPW,Jupiter Wellness Inc. Common Stock,United States,2020.0,Health Care,Biotechnology: Pharmaceutical Preparations
JUPWW,Jupiter Wellness Inc. Warrant,United States,2020.0,Health Care,Biotechnology: Pharmaceutical Preparations
JVA,Coffee Holding Co. Inc. Common Stock,United States,2005.0,Consumer Non-Durables,Specialty Foods
JWEL,Jowell Global Ltd. Ordinary Shares,China,2021.0,Consumer Services,Other Consumer Services
JYAC,Jiya Acquisition Corp. Class A Common Stock,United States,2020.0,,
JYNT,The Joint Corp. Common Stock,United States,2014.0,,
JZXN,Jiuzi Holdings Inc. Ordinary Shares,China,2021.0,Consumer Durables,Automotive Aftermarket
KAII,Kismet Acquisition Two Corp. Class A Ordinary Shares,United States,2021.0,Finance,Business Services
KAIIU,Kismet Acquisition Two Corp. Unit,United States,2021.0,Finance,Business Services
KAIIW,Kismet Acquisition Two Corp. Warrant,United States,2021.0,Finance,Business Services
KAIR,Kairos Acquisition Corp. Class A Ordinary Shares,United States,2021.0,Finance,Business Services
KAIRU,Kairos Acquisition Corp. Unit,United States,2021.0,Finance,Business Services
KAIRW,Kairos Acquisition Corp. Warrant,United States,2021.0,Finance,Business Services
KALA,Kala Pharmaceuticals Inc. Common Stock,United States,2017.0,Health Care,Biotechnology: Pharmaceutical Preparations
KALU,Kaiser Aluminum Corporation Common Stock,United States,,Basic Industries,Aluminum
KALV,KalVista Pharmaceuticals Inc. Common Stock,United Kingdom,2015.0,Health Care,Biotechnology: Pharmaceutical Preparations
KARO,Karooooo Ltd. Ordinary Shares,Singapore,2021.0,Technology,Computer Software: Prepackaged Software
KAVL,Kaival Brands Innovations Group Inc. Common Stock,United States,,Consumer Non-Durables,Farming/Seeds/Milling
KBAL,Kimball International Inc. Class B Common Stock,United States,,Consumer Durables,Industrial Specialties
KBNT,Kubient Inc. Common Stock,United States,2020.0,Technology,EDP Services
KBNTW,Kubient Inc. Warrant,United States,2020.0,Technology,EDP Services
KC,Kingsoft Cloud Holdings Limited American Depositary Shares,China,2020.0,Technology,Computer Software: Prepackaged Software
KDNY,Chinook Therapeutics Inc. Common Stock,United States,2015.0,Health Care,Biotechnology: Pharmaceutical Preparations
KDP,Keurig Dr Pepper Inc. Common Stock,United States,,Consumer Non-Durables,Beverages (Production/Distribution)
KE,Kimball Electronics Inc. Common Stock,United States,,Capital Goods,Industrial Machinery/Components
KELYA,Kelly Services Inc. Class A Common Stock,United States,,Technology,Diversified Commercial Services
KELYB,Kelly Services Inc. Class B Common Stock,United States,,Technology,Diversified Commercial Services
KEQU,Kewaunee Scientific Corporation Common Stock,United States,,Capital Goods,Medical Specialities
KERN,Akerna Corp. Common Stock,United States,2018.0,Health Care,Managed Health Care
KERNW,Akerna Corp Warrant,United States,2018.0,Health Care,Managed Health Care
KFFB,Kentucky First Federal Bancorp Common Stock,United States,,Finance,Savings Institutions
KFRC,Kforce Inc. Common Stock,United States,1995.0,Technology,Diversified Commercial Services
KHC,The Kraft Heinz Company Common Stock,United States,,Consumer Non-Durables,Farming/Seeds/Milling
KIDS,OrthoPediatrics Corp. Common Stock,United States,2017.0,Health Care,Medical/Dental Instruments
KIII,Kismet Acquisition Three Corp. Class A Ordinary Shares,United States,2021.0,Finance,Business Services
KIIIU,Kismet Acquisition Three Corp. Unit,United States,2021.0,Finance,Business Services
KIIIW,Kismet Acquisition Three Corp. Warrant,United States,2021.0,Finance,Business Services
KINS,Kingstone Companies Inc. Common Stock,United States,,Finance,Specialty Insurers
KINZ,KINS Technology Group Inc. Class A Common Stock,United States,2021.0,,
KINZU,KINS Technology Group Inc. Unit,United States,2020.0,,
KINZW,KINS Technology Group Inc. Warrant,United States,2021.0,,
KIRK,Kirkland's Inc. COMMONSTOCK,United States,2002.0,Miscellaneous,Diversified Commercial Services
KLAC,KLA Corporation Common Stock,United States,1980.0,Capital Goods,Electronic Components
KLAQ,KL Acquisition Corp Class A Common Stock,United States,2021.0,,
KLAQU,KL Acquisition Corp Unit,United States,2021.0,,
KLAQW,KL Acquisition Corp Warrant,United States,2021.0,,
KLDO,Kaleido Biosciences Inc. Common Stock,United States,2019.0,Health Care,Biotechnology: Biological Products (No Diagnostic Substances)
KLIC,Kulicke and Soffa Industries Inc. Common Stock,Singapore,,Technology,Semiconductors
KLTR,Kaltura Inc. Common Stock,United States,2021.0,Technology,EDP Services
KLXE,KLX Energy Services Holdings Inc. Common Stock,United States,,Energy,Oilfield Services/Equipment
KMDA,Kamada Ltd. Ordinary Shares,Israel,2013.0,Health Care,Biotechnology: Pharmaceutical Preparations
KMPH,KemPharm Inc. Common Stock,United States,,Health Care,Biotechnology: Pharmaceutical Preparations
KNBE,KnowBe4 Inc. Class A Common Stock,United States,2021.0,Technology,Computer Software: Prepackaged Software
KNDI,Kandi Technologies Group Inc Common Stock,China,,Capital Goods,Auto Parts:O.E.M.
KNSA,Kiniksa Pharmaceuticals Ltd. Class A Common Stock,United States,2018.0,Health Care,Biotechnology: Pharmaceutical Preparations
KNSL,Kinsale Capital Group Inc. Common Stock,United States,2016.0,Finance,Property-Casualty Insurers
KNTE,Kinnate Biopharma Inc. Common Stock,United States,2020.0,Health Care,Biotechnology: Pharmaceutical Preparations
KOD,Kodiak Sciences Inc Common Stock,United States,2018.0,Health Care,Biotechnology: Pharmaceutical Preparations
KOPN,Kopin Corporation Common Stock,United States,1992.0,Capital Goods,Industrial Machinery/Components
KOR,Corvus Gold Inc. Common Shares,Canada,,,
KOSS,Koss Corporation Common Stock,United States,,Consumer Non-Durables,Consumer Electronics/Appliances
KPLT,Katapult Holdings Inc. Common Stock,United States,2019.0,Technology,EDP Services
KPLTW,Katapult Holdings Inc. Warrant,United States,2019.0,Technology,EDP Services
KPRX,Kiora Pharmaceuticals Inc.  Common Stock,United States,,Health Care,Biotechnology: In Vitro & In Vivo Diagnostic Substances
KPTI,Karyopharm Therapeutics Inc. Common Stock,United States,2013.0,Miscellaneous,Diversified Commercial Services
KRBP,Kiromic BioPharma Inc. Common Stock,United States,2020.0,Consumer Durables,Specialty Chemicals
KRKR,36Kr Holdings Inc. American Depositary Shares,China,2019.0,Miscellaneous,Business Services
KRMD,Repro Med Systems Inc. Common Stock,United States,,Health Care,Medical/Dental Instruments
KRNL,Kernel Group Holdings Inc. Class A Ordinary Shares,United States,2021.0,Finance,Business Services
KRNLU,Kernel Group Holdings Inc. Units,United States,2021.0,Finance,Business Services
KRNLW,Kernel Group Holdings Inc. Warrants,United States,2021.0,Finance,Business Services
KRNT,Kornit Digital Ltd. Ordinary Shares,Israel,2015.0,Capital Goods,Industrial Machinery/Components
KRNY,Kearny Financial Corp Common Stock,United States,,Finance,Savings Institutions
KRON,Kronos Bio Inc. Common Stock,United States,2020.0,Consumer Durables,Specialty Chemicals
KROS,Keros Therapeutics Inc. Common Stock,United States,2020.0,Consumer Durables,Specialty Chemicals
KRT,Karat Packaging Inc. Common Stock,United States,2021.0,Capital Goods,Office Equipment/Supplies/Services
KRTX,Karuna Therapeutics Inc. Common Stock,United States,2019.0,Health Care,Biotechnology: Pharmaceutical Preparations
KRUS,Kura Sushi USA Inc. Class A Common Stock,United States,2019.0,Consumer Services,Restaurants
KRYS,Krystal Biotech Inc. Common Stock,United States,2017.0,Health Care,Biotechnology: Biological Products (No Diagnostic Substances)
KSI,Kadem Sustainable Impact Corporation Class A common stock,United States,2021.0,,
KSICW,Kadem Sustainable Impact Corporation Warrant,United States,2021.0,,
KSPN,Kaspien Holdings Inc. Common Stock,United States,,Consumer Services,Consumer Electronics/Video Chains
KTCC,Key Tronic Corporation Common Stock,United States,1983.0,Technology,Computer peripheral equipment
KTOS,Kratos Defense & Security Solutions Inc. Common Stock,United States,,Consumer Non-Durables,Ordnance And Accessories
KTRA,Kintara Therapeutics Inc. Common Stock,United States,,Health Care,Biotechnology: Pharmaceutical Preparations
KTTA,Pasithea Therapeutics Corp. Common Stock,United States,2021.0,Health Care,Biotechnology: Pharmaceutical Preparations
KTTAW,Pasithea Therapeutics Corp. Warrant,United States,2021.0,Health Care,Biotechnology: Pharmaceutical Preparations
KURA,Kura Oncology Inc. Common Stock,United States,,Health Care,Biotechnology: Biological Products (No Diagnostic Substances)
KVHI,KVH Industries Inc. Common Stock,United States,1996.0,Technology,Radio And Television Broadcasting And Communications Equipment
