Symbol,Name,Country,IPO,Sector,Industry
CSGP,CoStar Group Inc. Common Stock,United States,1998.0,Finance,Real Estate
CSGS,CSG Systems International Inc. Common Stock,United States,1996.0,Technology,EDP Services
CSII,Cardiovascular Systems Inc. Common Stock,United States,1981.0,Health Care,Medical/Dental Instruments
CSIQ,Canadian Solar Inc. Common Shares (BC),China,2006.0,,
CSPI,CSP Inc. Common Stock,United States,1982.0,Technology,EDP Services
CSQ,Calamos Strategic Total Return Common Stock,United States,2004.0,Finance,Finance Companies
CSSE,Chicken Soup for the Soul Entertainment Inc. Class A Common Stock,United States,2017.0,Consumer Services,Broadcasting
CSSEN,Chicken Soup for the Soul Entertainment Inc. 9.50% Notes due 2025,United States,,Consumer Services,Movies/Entertainment
CSSEP,Chicken Soup for the Soul Entertainment Inc. 9.75% Series A Cumulative Redeemable Perpetual Preferred Stock,United States,,Consumer Services,Broadcasting
CSTE,Caesarstone Ltd. Ordinary Shares,Israel,2012.0,Capital Goods,Building Materials
CSTL,Castle Biosciences Inc. Common Stock,United States,2019.0,Health Care,Medical Specialities
CSTR,CapStar Financial Holdings Inc. Common Stock,United States,2016.0,Finance,Major Banks
CSWC,Capital Southwest Corporation Common Stock,United States,,Finance,Finance/Investors Services
CSWI,CSW Industrials Inc. Common Stock,United States,,Basic Industries,Home Furnishings
CSX,CSX Corporation Common Stock,United States,,Transportation,Railroads
CTAQ,Carney Technology Acquisition Corp. II Class A Common Stock,United States,2021.0,,
CTAQW,Carney Technology Acquisition Corp. II Warrant,United States,2021.0,,
CTAS,Cintas Corporation Common Stock,United States,1983.0,Miscellaneous,Business Services
CTBI,Community Trust Bancorp Inc. Common Stock,United States,,Finance,Major Banks
CTG,Computer Task Group Inc. Common Stock,United States,,Technology,EDP Services
CTHR,Charles & Colvard Ltd Common Stock,United States,1997.0,Consumer Non-Durables,Consumer Specialties
CTIB,Yunhong CTI Ltd. Common Stock,United States,1997.0,Miscellaneous,Diversified Commercial Services
CTIC,CTI BioPharma Corp. (DE) Common Stock,United States,1997.0,Health Care,Biotechnology: Pharmaceutical Preparations
CTKB,Cytek Biosciences Inc. Common Stock,United States,2021.0,Health Care,Biotechnology: Electromedical & Electrotherapeutic Apparatus
CTLP,Cantaloupe Inc. Common Stock,United States,,Technology,EDP Services
CTMX,CytomX Therapeutics Inc. Common Stock,United States,2015.0,Health Care,Biotechnology: Pharmaceutical Preparations
CTRE,CareTrust REIT Inc. Common Stock,United States,,Consumer Services,Real Estate Investment Trusts
CTRM,Castor Maritime Inc. Common Shares,Cyprus,,Transportation,Marine Transportation
CTRN,Citi Trends Inc. Common Stock,United States,2005.0,,
CTSH,Cognizant Technology Solutions Corporation Class A Common Stock,United States,1998.0,Technology,EDP Services
CTSO,Cytosorbents Corporation Common Stock,United States,,Health Care,Medical/Dental Instruments
CTXR,Citius Pharmaceuticals Inc. Common Stock,United States,,Health Care,Biotechnology: Pharmaceutical Preparations
CTXRW,Citius Pharmaceuticals Inc. Warrant,United States,,Health Care,Biotechnology: Pharmaceutical Preparations
CTXS,Citrix Systems Inc. Common Stock,United States,1995.0,Technology,Computer Software: Prepackaged Software
CUBA,Herzfeld Caribbean Basin Fund Inc. (The) Common Stock,United States,,Finance,Investment Managers
CUE,Cue Biopharma Inc. Common Stock,United States,2018.0,Health Care,Biotechnology: Pharmaceutical Preparations
CUEN,Cuentas Inc. Common Stock,United States,,Technology,Computer Software: Prepackaged Software
CUENW,Cuentas Inc. Warrant,United States,,Technology,Computer Software: Prepackaged Software
CULL,Cullman Bancorp Inc. Common Stock,United States,2021.0,Finance,Savings Institutions
CURI,CuriosityStream Inc. Class A Common Stock,United States,2020.0,Consumer Services,Broadcasting
CURIW,CuriosityStream Inc. Warrant,United States,2020.0,Consumer Services,Broadcasting
CUTR,Cutera Inc. Common Stock,United States,2004.0,Health Care,Biotechnology: Electromedical & Electrotherapeutic Apparatus
CVAC,CureVac N.V. Ordinary Shares,Germany,2020.0,Health Care,Biotechnology: Pharmaceutical Preparations
CVBF,CVB Financial Corporation Common Stock,United States,,Finance,Major Banks
CVCO,Cavco Industries Inc. Common Stock When Issued,United States,,Basic Industries,Homebuilding
CVCY,Central Valley Community Bancorp Common Stock,United States,,Finance,Major Banks
CVET,Covetrus Inc. Common Stock,United States,,Health Care,Managed Health Care
CVGI,Commercial Vehicle Group Inc. Common Stock,United States,2004.0,Capital Goods,Auto Parts:O.E.M.
CVGW,Calavo Growers Inc. Common Stock,United States,,,Farming/Seeds/Milling
CVLG,Covenant Logistics Group Inc. Class A Common Stock,United States,,Transportation,Trucking Freight/Courier Services
CVLT,Commvault Systems Inc. Common Stock,United States,2006.0,Technology,Computer Software: Prepackaged Software
CVLY,Codorus Valley Bancorp Inc Common Stock,United States,,Finance,Savings Institutions
CVRX,CVRx Inc. Common Stock,United States,2021.0,Health Care,Biotechnology: Electromedical & Electrotherapeutic Apparatus
CVV,CVD Equipment Corporation Common Stock,United States,,Technology,Industrial Machinery/Components
CWBC,Community West Bancshares Common Stock,United States,,Finance,Major Banks
CWBR,CohBar Inc. Common Stock,United States,,Health Care,Biotechnology: In Vitro & In Vivo Diagnostic Substances
CWCO,Consolidated Water Co. Ltd. Ordinary Shares,Cayman Islands,,Public Utilities,Water Supply
CWST,Casella Waste Systems Inc. Class A Common Stock,United States,1997.0,Public Utilities,Environmental Services
CXDO,Crexendo Inc. Common Stock,United States,,Consumer Services,Telecommunications Equipment
CYAD,Celyad Oncology SA American Depositary Shares,Belgium,2015.0,Health Care,Biotechnology: Pharmaceutical Preparations
CYAN,Cyanotech Corporation Common Stock,United States,,Consumer Non-Durables,Farming/Seeds/Milling
CYBE,CyberOptics Corporation Common Stock,United States,1987.0,Capital Goods,Electronic Components
CYBR,CyberArk Software Ltd. Ordinary Shares,Israel,2014.0,Technology,Computer Software: Prepackaged Software
CYCC,Cyclacel Pharmaceuticals Inc. Common Stock,United States,,Health Care,Biotechnology: Pharmaceutical Preparations
CYCCP,Cyclacel Pharmaceuticals Inc. 6% Convertible Preferred Stock,United States,,Health Care,Biotechnology: Pharmaceutical Preparations
CYCN,Cyclerion Therapeutics Inc. Common Stock,United States,,Health Care,Biotechnology: Pharmaceutical Preparations
CYN,Cyngn Inc. Common Stock,United States,2021.0,Technology,EDP Services
CYRN,CYREN Ltd. Ordinary Shares,United States,,Technology,Computer Software: Prepackaged Software
CYRX,CryoPort Inc. Common Stock,United States,,,
CYT,Cyteir Therapeutics Inc. Common Stock,United States,2021.0,Health Care,Biotechnology: Pharmaceutical Preparations
CYTH,Cyclo Therapeutics Inc. Common Stock,United States,,Health Care,Biotechnology: Pharmaceutical Preparations
CYTHW,Cyclo Therapeutics Inc. Warrant,United States,,Health Care,Biotechnology: Pharmaceutical Preparations
CYTK,Cytokinetics Incorporated Common Stock,United States,2004.0,Health Care,Biotechnology: Pharmaceutical Preparations
CYTO,Altamira Therapeutics Ltd. Common Shares 0.01 SF (Bermuda),Bermuda,2014.0,Health Care,Biotechnology: Pharmaceutical Preparations
CYXT,Cyxtera Technologies Inc. Class A Common Stock,United States,2020.0,Technology,EDP Services
CYXTW,Cyxtera Technologies Inc. Warrant,United States,2020.0,Technology,EDP Services
CZNC,Citizens & Northern Corp Common Stock,United States,,Finance,Major Banks
CZR,Caesars Entertainment Inc. Common Stock,United States,,Consumer Services,Hotels/Resorts
CZWI,Citizens Community Bancorp Inc. Common Stock,United States,,Finance,Savings Institutions
DADA,Dada Nexus Limited American Depositary Shares,China,2020.0,Consumer Services,Department/Specialty Retail Stores
DAIO,Data I/O Corporation Common Stock,United States,1981.0,Capital Goods,Industrial Machinery/Components
DAKT,Daktronics Inc. Common Stock,United States,1994.0,Capital Goods,Office Equipment/Supplies/Services
DALN,DallasNews Corporation Series A Common Stock,United States,,Consumer Services,Newspapers/Magazines
DALS,DA32 Life Science Tech Acquisition Corp. Class A Common Stock,United States,2021.0,,
DARE,Dare Bioscience Inc. Common Stock,United States,2014.0,Health Care,Biotechnology: Pharmaceutical Preparations
DATS,DatChat Inc. Common Stock,United States,2021.0,Technology,Computer Software: Prepackaged Software
DATSW,DatChat Inc. Series A Warrant,United States,2021.0,Technology,Computer Software: Prepackaged Software
DAWN,Day One Biopharmaceuticals Inc. Common Stock,United States,2021.0,Health Care,Biotechnology: Pharmaceutical Preparations
DBDR,Roman DBDR Tech Acquisition Corp. Class A Common Stock,United States,2020.0,,
DBDRW,Roman DBDR Tech Acquisition Corp. Warrant,United States,2020.0,,
DBGI,Digital Brands Group Inc. Common Stock,United States,2021.0,Consumer Non-Durables,Apparel
DBGIW,Digital Brands Group Inc. Warrant,United States,2021.0,Consumer Non-Durables,Apparel
DBTX,Decibel Therapeutics Inc. Common Stock,United States,2021.0,Health Care,Biotechnology: Pharmaceutical Preparations
DBVT,DBV Technologies S.A. American Depositary Shares,France,2014.0,Health Care,Biotechnology: Biological Products (No Diagnostic Substances)
DBX,Dropbox Inc. Class A Common Stock,United States,2018.0,Technology,Computer Software: Prepackaged Software
DCBO,Docebo Inc. Common Shares,Canada,,,
DCGO,DocGo Inc. Common Stock,United States,2020.0,Health Care,Managed Health Care
DCGOW,DocGo Inc. Warrants,United States,2020.0,Health Care,Managed Health Care
DCOM,Dime Community Bancshares Inc. Common Stock,United States,,Finance,Savings Institutions
DCOMP,Dime Community Bancshares Inc. Fixed-Rate Non-Cumulative Perpetual Preferred Stock Series A,United States,,Finance,Savings Institutions
DCPH,Deciphera Pharmaceuticals Inc. Common Stock,United States,2017.0,Health Care,Biotechnology: Pharmaceutical Preparations
DCRC,Decarbonization Plus Acquisition Corporation III Class A Common Stock,United States,2021.0,,
DCRCU,Decarbonization Plus Acquisition Corporation III Unit,United States,2021.0,,
DCRCW,Decarbonization Plus Acquisition Corporation III Warrant,United States,2021.0,,
DCRD,Decarbonization Plus Acquisition Corporation IV Class A Ordinary Share,United States,2021.0,,
DCRDU,Decarbonization Plus Acquisition Corporation IV Unit,United States,2021.0,,
DCRDW,Decarbonization Plus Acquisition Corporation IV Warrant,United States,2021.0,,
DCRN,Decarbonization Plus Acquisition Corporation II Class A Common stock,United States,2021.0,,
DCRNU,Decarbonization Plus Acquisition Corporation II Unit,United States,2021.0,,
DCRNW,Decarbonization Plus Acquisition Corporation II Warrant,United States,2021.0,,
DCT,Duck Creek Technologies Inc. Common Stock,United States,2020.0,Technology,Retail: Computer Software & Peripheral Equipment
DCTH,Delcath Systems Inc. Common Stock,United States,,Health Care,Medical Specialities
DDI,DoubleDown Interactive Co. Ltd. American Depository Shares,South Korea,2021.0,Technology,EDP Services
DDMX,DD3 Acquisition Corp. II Class A Common Stock,Mexico,2021.0,,
DDMXU,DD3 Acquisition Corp. II Unit,Mexico,2020.0,,
DDMXW,DD3 Acquisition Corp. II Warrant,Mexico,2021.0,,
DDOG,Datadog Inc. Class A Common Stock,United States,2019.0,Technology,EDP Services
DENN,Denny's Corporation Common Stock,United States,,Consumer Services,Restaurants
DERM,Journey Medical Corporation Common Stock,United States,2021.0,Health Care,Biotechnology: Pharmaceutical Preparations
DFFN,Diffusion Pharmaceuticals Inc. Common Stock,United States,,Health Care,Biotechnology: Pharmaceutical Preparations
DFH,Dream Finders Homes Inc. Class A Common Stock,United States,2021.0,,
DGHI,Digihost Technology Inc. Common Subordinate Voting Shares,Canada,,,
DGICA,Donegal Group Inc. Class A Common Stock,United States,,Finance,Property-Casualty Insurers
DGICB,Donegal Group Inc. Class B Common Stock,United States,1986.0,Finance,Property-Casualty Insurers
DGII,Digi International Inc. Common Stock,United States,1989.0,Technology,Computer peripheral equipment
DGLY,Digital Ally Inc. Common Stock,United States,,Miscellaneous,Diversified Manufacture
DGNS,Dragoneer Growth Opportunities Corp. II Class A Ordinary Shares,United States,2020.0,Finance,Business Services
DGNU,Dragoneer Growth Opportunities Corp. III Class A Ordinary Shares,United States,2021.0,Finance,Business Services
DH,Definitive Healthcare Corp. Class A Common Stock,United States,2021.0,Technology,Computer Software: Prepackaged Software
DHACU,Digital Health Acquisition Corp. Unit,United States,2021.0,,
DHBC,DHB Capital Corp. Class A common stock,United States,2021.0,,
DHBCU,DHB Capital Corp. Unit,United States,2021.0,,
DHBCW,DHB Capital Corp. Warrant,United States,2021.0,,
DHC,Diversified Healthcare Trust Common Shares of Beneficial Interest,United States,,Consumer Services,Real Estate Investment Trusts
DHCA,DHC Acquisition Corp. Class A ordinary share,United States,2021.0,Finance,Business Services
DHCAU,DHC Acquisition Corp. Unit,United States,2021.0,Finance,Business Services
DHCAW,DHC Acquisition Corp. Warrant,United States,2021.0,Finance,Business Services
DHCNI,Diversified Healthcare Trust 5.625% Senior Notes due 2042,United States,,Consumer Services,Real Estate Investment Trusts
DHCNL,Diversified Healthcare Trust 6.25% Senior Notes Due 2046,United States,,Consumer Services,Real Estate Investment Trusts
DHHC,DiamondHead Holdings Corp. Class A Common Stock,United States,2021.0,,
DHHCU,DiamondHead Holdings Corp. Unit,United States,2021.0,,
DHHCW,DiamondHead Holdings Corp. Warrant,United States,2021.0,,
DHIL,Diamond Hill Investment Group Inc. Class A Common Stock,United States,,Finance,Investment Managers
DIBS,1stdibs.com Inc. Common Stock,United States,2021.0,Miscellaneous,Diversified Commercial Services
DICE,DICE Therapeutics Inc. Common Stock,United States,2021.0,Health Care,Biotechnology: Pharmaceutical Preparations
DILAW,DILA Capital Acquisition Corp. Warrant,Mexico,2021.0,,
DIOD,Diodes Incorporated Common Stock,United States,,Technology,Semiconductors
DISA,Disruptive Acquisition Corporation I Class A Ordinary Shares,United States,2021.0,Finance,Business Services
DISAU,Disruptive Acquisition Corporation I Unit,United States,2021.0,Finance,Business Services
DISAW,Disruptive Acquisition Corporation I Warrant,United States,2021.0,Finance,Business Services
DISCA,Discovery Inc. Series A Common Stock,United States,,Consumer Services,Television Services
DISCB,Discovery Inc. Series B Common Stock,United States,,Consumer Services,Television Services
DISCK,Discovery Inc. Series C Common Stock,United States,,Consumer Services,Television Services
DISH,DISH Network Corporation Class A Common Stock,United States,1995.0,Consumer Services,Television Services
DJCO,Daily Journal Corp. (S.C.) Common Stock,United States,,Consumer Services,Newspapers/Magazines
DKDCA,Data Knights Acquisition Corp. Class A Common Stock,United Kingdom,2021.0,,
DKDCU,Data Knights Acquisition Corp. Unit,United Kingdom,2021.0,,
DKDCW,Data Knights Acquisition Corp. Warrant,United Kingdom,2021.0,,
DKNG,DraftKings Inc. Class A Common Stock,United States,2019.0,Consumer Services,Services-Misc. Amusement & Recreation
DLCA,Deep Lake Capital Acquisition Corp. Class A Ordinary Shares,United States,2021.0,Finance,Business Services
DLCAU,Deep Lake Capital Acquisition Corp. Unit,United States,2021.0,Finance,Business Services
DLCAW,Deep Lake Capital Acquisition Corp. Warrant,United States,2021.0,Finance,Business Services
DLHC,DLH Holdings Corp.,United States,,Miscellaneous,Business Services
DLO,DLocal Limited Class A Common Shares,Uruguay,2021.0,,
DLPN,Dolphin Entertainment Inc. Common Stock,United States,,,
DLTH,Duluth Holdings Inc. Class B Common Stock,United States,2015.0,Consumer Services,Department/Specialty Retail Stores
DLTR,Dollar Tree Inc. Common Stock,United States,1995.0,Consumer Services,Department/Specialty Retail Stores
DMAC,DiaMedica Therapeutics Inc. Common Stock,United States,2018.0,,
DMAQU,Deep Medicine Acquisition Corp. Unit,United States,2021.0,,
DMLP,Dorchester Minerals L.P. Common Units Representing Limited Partnership Interests,United States,,Energy,Oil & Gas Production
DMRC,Digimarc Corporation Common Stock,United States,,Technology,EDP Services
DMTK,DermTech Inc. Common Stock,United States,2017.0,Health Care,Managed Health Care
DNAA,Social Capital Suvretta Holdings Corp. I Class A Ordinary Share,United States,2021.0,,
DNAB,Social Capital Suvretta Holdings Corp. II Class A Ordinary Shares,United States,2021.0,,
DNAC,Social Capital Suvretta Holdings Corp. III Class A ordinary shares,United States,2021.0,,
DNAD,Social Capital Suvretta Holdings Corp. IV Class A Ordinary Shares,United States,2021.0,Health Care,Biotechnology: Pharmaceutical Preparations
DNAY,Codex DNA Inc. Common Stock,United States,2021.0,Health Care,Medical Specialities
DNLI,Denali Therapeutics Inc. Common Stock,United States,2017.0,Health Care,Biotechnology: Biological Products (No Diagnostic Substances)
DNUT,Krispy Kreme Inc. Common Stock,United States,2021.0,Consumer Services,Specialty Foods
DOCU,DocuSign Inc. Common Stock,United States,2018.0,Technology,EDP Services
DOGZ,Dogness (International) Corporation Class A Common Stock,China,2017.0,Consumer Durables,Miscellaneous manufacturing industries
DOMO,Domo Inc. Class B Common Stock,United States,2018.0,Technology,Computer Software: Prepackaged Software
DOOO,BRP Inc. (Recreational Products) Common Subordinate Voting Shares,Canada,,,
DORM,Dorman Products Inc. Common Stock,United States,,Capital Goods,Auto Parts:O.E.M.
DOX,Amdocs Limited Ordinary Shares,Guernsey,,Technology,EDP Services
DOYU,DouYu International Holdings Limited ADS,China,2019.0,Technology,Computer Software: Programming Data Processing
DPCSU,DP Cap Acquisition Corp I Unit,United States,2021.0,,
DPRO,Draganfly Inc. Common Shares,Canada,,Consumer Durables,Electronic Components
DRAY,Macondray Capital Acquisition Corp. I Class A Ordinary Shares,United States,2021.0,,
DRAYU,Macondray Capital Acquisition Corp. I Unit,United States,2021.0,,
DRAYW,Macondray Capital Acquisition Corp. I Warrant,United States,2021.0,,
DRIO,DarioHealth Corp. Common Stock,Israel,,Health Care,Medical/Dental Instruments
DRMA,Dermata Therapeutics Inc. Common Stock,United States,2021.0,Health Care,Biotechnology: Pharmaceutical Preparations
DRMAW,Dermata Therapeutics Inc. Warrant,United States,2021.0,Health Care,Biotechnology: Pharmaceutical Preparations
DRNA,Dicerna Pharmaceuticals Inc. Common Stock,United States,2014.0,Health Care,Biotechnology: Commercial Physical & Biological Resarch
DRRX,DURECT Corporation Common Stock,United States,2000.0,Health Care,Biotechnology: Pharmaceutical Preparations
DRTT,DIRTT Environmental Solutions Ltd. Common Shares,Canada,,,
DRUG,Bright Minds Biosciences Inc. Common Stock,Canada,,,
DRVN,Driven Brands Holdings Inc. Common Stock,United States,2021.0,,
DSAC,Duddell Street Acquisition Corp. Class A Ordinary Shares,Hong Kong,2020.0,Finance,Business Services
DSACU,Duddell Street Acquisition Corp. Unit,Hong Kong,2020.0,Finance,Business Services
DSACW,Duddell Street Acquisition Corp. Warrant,Hong Kong,2020.0,Finance,Business Services
DSEY,Diversey Holdings Ltd. Ordinary Shares,United States,2021.0,Consumer Durables,Specialty Chemicals
DSGN,Design Therapeutics Inc. Common Stock,United States,2021.0,Health Care,Biotechnology: Pharmaceutical Preparations
DSGX,Descartes Systems Group Inc. (The) Common Stock,Canada,,,
DSKE,Daseke Inc. Common Stock,United States,2015.0,,
DSKEW,Daseke Inc. Warrant,United States,2015.0,,
DSP,Viant Technology Inc. Class A Common Stock,United States,2021.0,Technology,EDP Services
DSPG,DSP Group Inc. Common Stock,United States,1994.0,Technology,Semiconductors
DSWL,Deswell Industries Inc. Common Shares,Macau,1995.0,Consumer Non-Durables,Plastic Products
DTEA,DAVIDsTEA Inc. Common Stock,Canada,2015.0,,
DTIL,Precision BioSciences Inc. Common Stock,United States,2019.0,Health Care,Biotechnology: Pharmaceutical Preparations
DTOC,Digital Transformation Opportunities Corp. Class A Common Stock,United States,2021.0,,
DTOCU,Digital Transformation Opportunities Corp. Units,United States,2021.0,,
DTOCW,Digital Transformation Opportunities Corp. Warrant,United States,2021.0,,
DTRT,DTRT Health Acquisition Corp. Class A Common Stock,United States,2021.0,,
DTRTU,DTRT Health Acquisition Corp. Unit,United States,2021.0,,
DTRTW,DTRT Health Acquisition Corp. Warrant,United States,2021.0,,
DTSS,Datasea Inc. Common Stock,China,,Technology,Retail: Computer Software & Peripheral Equipment
DTST,Data Storage Corporation Common Stock,United States,,Technology,EDP Services
DTSTW,Data Storage Corporation Warrant,United States,,Technology,EDP Services
DUNE,Dune Acquisition Corporation Class A Common Stock,United States,2021.0,,
DUNEU,Dune Acquisition Corporation Unit,United States,2020.0,,
DUNEW,Dune Acquisition Corporation Warrant,United States,2021.0,,
DUO,Fangdd Network Group Ltd. American Depositary Shares,China,2019.0,Technology,Computer Software: Programming Data Processing
DUOL,Duolingo Inc. Class A Common Stock,United States,2021.0,Technology,Computer Software: Prepackaged Software
DUOT,Duos Technologies Group Inc. Common Stock,United States,,Technology,Computer Software: Prepackaged Software
DVAX,Dynavax Technologies Corporation Common Stock,United States,2004.0,Health Care,Biotechnology: Pharmaceutical Preparations
DWAC,Digital World Acquisition Corp. Class A Common Stock,United States,2021.0,,
DWACU,Digital World Acquisition Corp. Units,United States,2021.0,,
DWACW,Digital World Acquisition Corp. Warrants,United States,2021.0,,
DWSN,Dawson Geophysical Company Common Stock,United States,,Energy,Oil & Gas Production
DXCM,DexCom Inc. Common Stock,United States,2005.0,Health Care,Medical Specialities
DXLG,Destination XL Group Inc. Common Stock,United States,,Consumer Services,Clothing/Shoe/Accessory Stores
DXPE,DXP Enterprises Inc. Common Stock,United States,,Capital Goods,Industrial Machinery/Components
DXYN,Dixie Group Inc. (The) Common Stock,United States,,Consumer Durables,Home Furnishings
DYAI,Dyadic International Inc. Common Stock,United States,,Health Care,Biotechnology: Biological Products (No Diagnostic Substances)
DYN,Dyne Therapeutics Inc. Common Stock,United States,2020.0,Consumer Durables,Specialty Chemicals
DYNS,Dynamics Special Purpose Corp. Class A Common Stock,United States,2021.0,,
DYNT,Dynatronics Corporation Common Stock,United States,,Health Care,Medical/Dental Instruments
DZSI,DZS Inc. Common Stock,United States,,Public Utilities,Telecommunications Equipment
EA,Electronic Arts Inc. Common Stock,United States,,Technology,Computer Software: Prepackaged Software
EAC,Edify Acquisition Corp. Class A Common Stock,United States,2021.0,,
EACPU,Edify Acquisition Corp. Units,United States,2021.0,,
EACPW,Edify Acquisition Corp. Warrant,United States,2021.0,,
EAR,Eargo Inc. Common Stock,United States,2020.0,Health Care,Medical Specialities
EAST,Eastside Distilling Inc. Common Stock,United States,,Consumer Non-Durables,Beverages (Production/Distribution)
EBAC,European Biotech Acquisition Corp. Class A Ordinary Shares,Netherlands,2021.0,Finance,Business Services
EBACU,European Biotech Acquisition Corp. Units,Netherlands,2021.0,Finance,Business Services
EBACW,European Biotech Acquisition Corp. Warrant,Netherlands,2021.0,Finance,Business Services
EBAY,eBay Inc. Common Stock,United States,1998.0,Consumer Services,Catalog/Specialty Distribution
EBC,Eastern Bankshares Inc. Common Stock,United States,2020.0,Finance,Major Banks
EBET,Esports Technologies Inc. Common Stock,United States,2021.0,Consumer Services,Services-Misc. Amusement & Recreation
EBIX,Ebix Inc. Common Stock,United States,,Technology,EDP Services
EBMT,Eagle Bancorp Montana Inc. Common Stock,United States,,Finance,Savings Institutions
EBON,Ebang International Holdings Inc. Class A Ordinary Shares,China,2020.0,Technology,Semiconductors
EBTC,Enterprise Bancorp Inc Common Stock,United States,,Finance,Major Banks
ECOL,US Ecology Inc Common Stock,United States,,Public Utilities,Environmental Services
ECOLW,US Ecology Inc. Warrant,United States,,Public Utilities,Environmental Services
ECOR,electroCore Inc. Common Stock,United States,2018.0,Health Care,Biotechnology: Electromedical & Electrotherapeutic Apparatus
ECPG,Encore Capital Group Inc Common Stock,United States,,,
EDAP,EDAP TMS S.A. American Depositary Shares,France,1997.0,Health Care,Biotechnology: Electromedical & Electrotherapeutic Apparatus
EDIT,Editas Medicine Inc. Common Stock,United States,2016.0,Health Care,Biotechnology: Pharmaceutical Preparations
EDNC,Endurance Acquisition Corp. Class A Ordinary Shares,United States,2021.0,,
EDNCU,Endurance Acquisition Corp. Unit,United States,2021.0,,
EDNCW,Endurance Acquisition Corp. Warrant,United States,2021.0,,
EDRY,EuroDry Ltd. Common Shares ,Greece,,Consumer Services,Marine Transportation
EDSA,Edesa Biotech Inc. Common Shares,United States,,,
EDTK,Skillful Craftsman Education Technology Limited Ordinary Share,China,2020.0,Consumer Services,Other Consumer Services
EDTX,EdtechX Holdings Acquisition Corp. II Class A common stock,United Kingdom,2021.0,,
EDTXW,EdtechX Holdings Acquisition Corp. II Warrant,United Kingdom,2021.0,,
EDUC,Educational Development Corporation Common Stock,United States,,Consumer Services,Books
EEFT,Euronet Worldwide Inc. Common Stock,United States,1997.0,Technology,EDP Services
EEIQ,Elite Education Group International Ltd. Common Stock,United States,2021.0,Consumer Services,Other Consumer Services
EFOI,Energy Focus Inc. Common Stock,United States,,Consumer Durables,Building Products
EFSC,Enterprise Financial Services Corporation Common Stock,United States,,Finance,Major Banks
